journal_id,journal_label,pep_code_candidate,probe_year,document_id,pep_code_record,year_record,title,authors,source_title,volume,issue,pages,doi,article_type,has_abstract,has_keywords,n_keywords,keywords_joined,keyword_source,art_kwds_count,source_file
psychoanalytic_psychotherapy,Psychoanalytic Psychotherapy,,2005,PPTX.019.0004A,PPTX,2005,The ‘Other 23 Hours’: Special Problems of Psychotherapy in a ‘Special’ Hospital,Sameer P. Sarkar,Psychoanalytic Psychotherapy,19,1,4-16,,ART,True,False,0,,,0,data\raw_pep_metadata\psychoanalytic_psychotherapy_probe\psychoanalytic_psychotherapy_nopep_2005_art_id_PPTX._AND_year_2005.json
psychoanalytic_psychotherapy,Psychoanalytic Psychotherapy,,2005,PPTX.019.0098A,PPTX,2005,"From Toxic Institutions to Therapeutic Environments; Residential Settings in Mental Health Services edited by Penelope Campling, Stefan Davies and Graeme Farquharson (Royal College of Psychiatrists, 2004). 286 pp. £25.00.",Kevin Healy,Psychoanalytic Psychotherapy,19,1,98-100,,REV,True,False,0,,,0,data\raw_pep_metadata\psychoanalytic_psychotherapy_probe\psychoanalytic_psychotherapy_nopep_2005_art_id_PPTX._AND_year_2005.json
psychoanalytic_psychotherapy,Psychoanalytic Psychotherapy,,2005,PPTX.019.0247A,PPTX,2005,BOOK REVIEWS,,Psychoanalytic Psychotherapy,19,3,247-256,10.1080/02668730500238580,REV,True,False,0,,,0,data\raw_pep_metadata\psychoanalytic_psychotherapy_probe\psychoanalytic_psychotherapy_nopep_2005_art_id_PPTX._AND_year_2005.json
psychoanalytic_psychotherapy,Psychoanalytic Psychotherapy,,2005,PPTX.019.0035A,PPTX,2005,The Use of ‘Case Study’ in Psychotherapeutic Research and Education,Dennis Greenwood and  Del Loewenthal,Psychoanalytic Psychotherapy,19,1,35-47,,ART,True,False,0,,,0,data\raw_pep_metadata\psychoanalytic_psychotherapy_probe\psychoanalytic_psychotherapy_nopep_2005_art_id_PPTX._AND_year_2005.json
psychoanalytic_psychotherapy,Psychoanalytic Psychotherapy,,2005,PPTX.019.0093A,PPTX,2005,"Emotional Development in Psychoanalysis, Attachment Theory and Neuroscience: Creating Connections edited by Viviane Green (Hove and New York, Brunner-Routledge, 2003). 248 pp.",Kay Goddard,Psychoanalytic Psychotherapy,19,1,93-95,,REV,True,False,0,,,0,data\raw_pep_metadata\psychoanalytic_psychotherapy_probe\psychoanalytic_psychotherapy_nopep_2005_art_id_PPTX._AND_year_2005.json
psychoanalytic_psychotherapy,Psychoanalytic Psychotherapy,,2005,PPTX.019.0048A,PPTX,2005,Private Theories and Psychotherapeutic Technique,"Björn Philips,  Andrzej Werbart and  Johan Schubert",Psychoanalytic Psychotherapy,19,1,48-70,,ART,True,False,0,,,0,data\raw_pep_metadata\psychoanalytic_psychotherapy_probe\psychoanalytic_psychotherapy_nopep_2005_art_id_PPTX._AND_year_2005.json
psychoanalytic_psychotherapy,Psychoanalytic Psychotherapy,,2005,PPTX.019.0121A,PPTX,2005,Contributing to A Treatment Trial of Group Therapy: ‘Psychotherapy Supervisor’ or ‘Therapeutic Consultant’?,Adrian Sutton,Psychoanalytic Psychotherapy,19,2,121-134,,ART,True,False,0,,,0,data\raw_pep_metadata\psychoanalytic_psychotherapy_probe\psychoanalytic_psychotherapy_nopep_2005_art_id_PPTX._AND_year_2005.json
psychoanalytic_psychotherapy,Psychoanalytic Psychotherapy,,2005,PPTX.019.0221A,PPTX,2005,DANGEROUS LIAISONS: PSYCHOSIS AND VIOLENCE – WORKING IN A PSYCHIATRIC INTENSIVE CARE UNIT,Paul Terry,Psychoanalytic Psychotherapy,19,3,221-232,10.1080/02668730500238234,ART,True,False,0,,,0,data\raw_pep_metadata\psychoanalytic_psychotherapy_probe\psychoanalytic_psychotherapy_nopep_2005_art_id_PPTX._AND_year_2005.json
psychoanalytic_psychotherapy,Psychoanalytic Psychotherapy,,2005,PPTX.019.0096A,PPTX,2005,"The Ethical Attitude in Analytic Practice edited by Hester McFarland Solomon and Mary Twyman (London & New York, Free Association Books, 2003). 183 pp. Paperback £18.99.",Adrian Sutton,Psychoanalytic Psychotherapy,19,1,96-98,,REV,True,False,0,,,0,data\raw_pep_metadata\psychoanalytic_psychotherapy_probe\psychoanalytic_psychotherapy_nopep_2005_art_id_PPTX._AND_year_2005.json
psychoanalytic_psychotherapy,Psychoanalytic Psychotherapy,,2005,PPTX.019.0233A,PPTX,2005,CONSCIOUSNESS-RAISING AND WELL-BEING IN PUBLIC SPHERE ORGANIZATIONS: A HISTORICAL REVIEW OF PSYCHOANALYTICAL APPROACHES,Gary Winship,Psychoanalytic Psychotherapy,19,3,233-245,10.1080/02668730500238325,ART,True,False,0,,,0,data\raw_pep_metadata\psychoanalytic_psychotherapy_probe\psychoanalytic_psychotherapy_nopep_2005_art_id_PPTX._AND_year_2005.json
psychoanalytic_psychotherapy,Psychoanalytic Psychotherapy,,2005,PPTX.019.0160A,PPTX,2005,On Aggression Turned against the Self,Anthony Parfitt,Psychoanalytic Psychotherapy,19,2,160-173,,ART,True,False,0,,,0,data\raw_pep_metadata\psychoanalytic_psychotherapy_probe\psychoanalytic_psychotherapy_nopep_2005_art_id_PPTX._AND_year_2005.json
psychoanalytic_psychotherapy,Psychoanalytic Psychotherapy,,2005,PPTX.019.0180A,PPTX,2005,"Attachment Trauma: Working with Dissociative Identity Disorder and Multiplicity edited by Valerie Sinason (Brunner-Routledge, Hove, East Sussex; Taylor & Francis, New York, 2002). 280 pp.",Judith Issroff,Psychoanalytic Psychotherapy,19,2,180-182,,REV,True,False,0,,,0,data\raw_pep_metadata\psychoanalytic_psychotherapy_probe\psychoanalytic_psychotherapy_nopep_2005_art_id_PPTX._AND_year_2005.json
psychoanalytic_psychotherapy,Psychoanalytic Psychotherapy,,2005,PPTX.019.0294A,PPTX,2005,"SETTING UP A COUNSELLING SERVICE FOR PARENTS, INFANTS AND YOUNG CHILDREN",Maria E. Pozzi and  Beverley Tydeman,Psychoanalytic Psychotherapy,19,4,294-309,10.1080/02668730500375325,ART,True,False,0,,,0,data\raw_pep_metadata\psychoanalytic_psychotherapy_probe\psychoanalytic_psychotherapy_nopep_2005_art_id_PPTX._AND_year_2005.json
psychoanalytic_psychotherapy,Psychoanalytic Psychotherapy,,2005,PPTX.019.0193A,PPTX,2005,PURE GOLD OF PSYCHOANALYSIS OR PURE CHEMISTRY? HOW CAN WE HANDLE THE COUNTER-TRANSFERENCE AND THE PSYCHOANALYST'S SUPER-EGO CONFLICTS IN COMBINED TREATMENT?1,Michael Günter,Psychoanalytic Psychotherapy,19,3,193-204,10.1080/02668730500238184,ART,True,False,0,,,0,data\raw_pep_metadata\psychoanalytic_psychotherapy_probe\psychoanalytic_psychotherapy_nopep_2005_art_id_PPTX._AND_year_2005.json
psychoanalytic_psychotherapy,Psychoanalytic Psychotherapy,,2005,PPTX.019.0310A,PPTX,2005,"BECOMING ANOREXIC: ON LOSS, DEATH AND IDENTIFICATION AND THE EMERGENCE OF ANOREXIA NERVOSA",Sarah Huline-Dickens,Psychoanalytic Psychotherapy,19,4,310-329,10.1080/02668730500383972,ART,True,False,0,,,0,data\raw_pep_metadata\psychoanalytic_psychotherapy_probe\psychoanalytic_psychotherapy_nopep_2005_art_id_PPTX._AND_year_2005.json
psychoanalytic_psychotherapy,Psychoanalytic Psychotherapy,,2005,PPTX.019.0089A,PPTX,2005,"New Clinical Realms by Salman Akhtar (Jason Aronson, Northvale, NJ, 2003). £36.50 hardback.",Damian Gamble,Psychoanalytic Psychotherapy,19,1,89-92,,REV,True,False,0,,,0,data\raw_pep_metadata\psychoanalytic_psychotherapy_probe\psychoanalytic_psychotherapy_nopep_2005_art_id_PPTX._AND_year_2005.json
psychoanalytic_psychotherapy,Psychoanalytic Psychotherapy,,2005,PPTX.019.0174A,PPTX,2005,"Untying the Knot: Working with Children and Parents by A. H. Brafman (Karnac Books, London, 2001). 166 pp. £19.99.",Rosemary Loshak,Psychoanalytic Psychotherapy,19,2,174-176,,REV,True,False,0,,,0,data\raw_pep_metadata\psychoanalytic_psychotherapy_probe\psychoanalytic_psychotherapy_nopep_2005_art_id_PPTX._AND_year_2005.json
psychoanalytic_psychotherapy,Psychoanalytic Psychotherapy,,2005,PPTX.019.0186A,PPTX,2005,"Culture and Psychotherapy: A Guide to Clinical Practice edited by Wen-Sing Tseng and Jon Streltzer (Psychiatric Press, Washington & London, 2001). 313 pp. £36.95.: Eating Disorders and Cultures in Transition edited by Mervat Nasser, Melanie Katzman and Richard Gordon (Taylor & Francis, Hove, 2002). 224 pp. £18.99.",Eia Asen,Psychoanalytic Psychotherapy,19,2,186-187,,REV,True,False,0,,,0,data\raw_pep_metadata\psychoanalytic_psychotherapy_probe\psychoanalytic_psychotherapy_nopep_2005_art_id_PPTX._AND_year_2005.json
psychoanalytic_psychotherapy,Psychoanalytic Psychotherapy,,2005,PPTX.019.0191A,PPTX,2005,EDITORIAL,Maureen Marks,Psychoanalytic Psychotherapy,19,3,191,10.1080/02668730500242160,COM,True,False,0,,,0,data\raw_pep_metadata\psychoanalytic_psychotherapy_probe\psychoanalytic_psychotherapy_nopep_2005_art_id_PPTX._AND_year_2005.json
psychoanalytic_psychotherapy,Psychoanalytic Psychotherapy,,2005,PPTX.019.0001A,PPTX,2005,Editorial,Maureen Marks,Psychoanalytic Psychotherapy,19,1,1-3,,COM,True,False,0,,,0,data\raw_pep_metadata\psychoanalytic_psychotherapy_probe\psychoanalytic_psychotherapy_nopep_2005_art_id_PPTX._AND_year_2005.json
