url,title,year,volume,issue,pages,doi,article_type
"https://www.psychiatriapolska.pl/Powiklania-gastroenterologiczne-i-zasady-realimentacji-pacjentow-z-jadlowstretem-psychicznym,65274,0,1.html",Powikłania gastroenterologiczne i zasady realimentacji pacjentów z jadłowstrętem psychicznym,2017,51,2,219-229,https://doi.org/10.12740/PP/65274,ARTICLE
"https://www.psychiatriapolska.pl/Mineralizacja-kosci-i-ocena-densytometryczna-zlaman-kregoslupa-u-kobiet-po-uplywie-6-21-lat-od-pojawienia-sie-objawow-jadlowstretu-psychicznego,63149,0,1.html",Mineralizacja kości i ocena densytometryczna złamań kręgosłupa u kobiet po upływie 6–21 lat od pojawienia się objawów jadłowstrętu psychicznego,2017,51,2,231-246,https://doi.org/10.12740/PP/63149,ARTICLE
"https://www.psychiatriapolska.pl/Kryteria-roznicowe-Zaburzenia-z-napadami-objadania-sie-i-Uzaleznienia-od-pozywienia-w-kontekscie-przyczyn-otylosci-oraz-jej-leczenia,62824,0,1.html",Kryteria różnicowe Zaburzenia z napadami objadania się i Uzależnienia od pożywienia w kontekście przyczyn otyłości oraz jej leczenia,2017,51,2,247-259,https://doi.org/10.12740/PP/OnlineFirst/62824,ARTICLE
"https://www.psychiatriapolska.pl/Schizofrenia-i-jadlowstret-psychiczny-wzajemne-powiazania-Przeglad-literatury,63514,0,1.html",Schizofrenia i jadłowstręt psychiczny – wzajemne powiązania. Przegląd literatury,2017,51,2,261-270,https://doi.org/10.12740/PP/OnlineFirst/63514,REVIEW
"https://www.psychiatriapolska.pl/Znaczenie-kliniczne-doznan-podobnych-do-psychotycznych-u-dzieci-i-mlodziezy-,63894,0,1.html",Znaczenie kliniczne doznań podobnych do psychotycznych u dzieci i młodzieży.,2017,51,2,271-282,https://doi.org/10.12740/PP/63894,ARTICLE
"https://www.psychiatriapolska.pl/Od-traumatycznych-wydarzen-i-dysocjacji-do-Ja-cielesnego-i-objawow-depresji-w-poszukiwaniu-syndromu-autodestruktywnosci-u-mlodziezy-dokonujacej-zamierzonych-samookaleczen,63801,0,1.html",Od traumatycznych wydarzeń i dysocjacji do Ja cielesnego i objawów depresji – w poszukiwaniu syndromu autodestruktywności u młodzieży dokonującej zamierzonych samookaleczeń,2017,51,2,283-301,https://doi.org/10.12740/PP/63801,ARTICLE
"https://www.psychiatriapolska.pl/Funkcje-zamierzonych-samookaleczen-i-ich-kliniczne-korelaty-wsrod-mlodziezy-hospitalizowanej-psychiatrycznie,63802,0,1.html",Funkcje zamierzonych samookaleczeń i ich kliniczne korelaty wśród młodzieży hospitalizowanej psychiatrycznie,2017,51,2,303-322,https://doi.org/10.12740/PP/63802,ARTICLE
"https://www.psychiatriapolska.pl/Samouszkodzenia-miejsce-w-klasyfikacjach-zaburzen-psychicznych-czynniki-ryzyka-i-mechanizmy-ksztaltujace-Przeglad-badan,62655,0,1.html","Samouszkodzenia – miejsce w klasyfikacjach zaburzeń psychicznych, czynniki ryzyka i mechanizmy kształtujące. Przegląd badań",2017,51,2,323-334,https://doi.org/10.12740/PP/62655,REVIEW
"https://www.psychiatriapolska.pl/Walidacja-polskiej-wersji-Kwestionariusza-Waszyngtonskiego-do-Oceny-Spektrum-Poalkoholowych-Wrodzonych-Zaburzen-Rozwojowych,62014,0,1.html",Walidacja polskiej wersji Kwestionariusza Waszyngtońskiego do Oceny Spektrum Poalkoholowych Wrodzonych Zaburzeń Rozwojowych,2017,51,2,335-347,https://doi.org/10.12740/PP/OnlineFirst/62014,ARTICLE
"https://www.psychiatriapolska.pl/Niepelnosprawnosc-wzrokowa-a-obecnosc-cech-autystycznych-u-dzieci,61352,0,1.html",Niepełnosprawność wzrokowa a obecność cech autystycznych u dzieci,2017,51,2,349-358,https://doi.org/10.12740/PP/OnlineFirst/61352,ARTICLE
"https://www.psychiatriapolska.pl/Profil-aminokwasowy-osocza-krwi-chlopcow-z-autyzmem,65046,0,1.html",Profil aminokwasowy osocza krwi chłopców z autyzmem,2017,51,2,359-368,https://doi.org/10.12740/PP/65046,ARTICLE
"https://www.psychiatriapolska.pl/Polska-adaptacja-Skali-Bolu-Psychicznego-Ronalda-Holdena-i-wspolpracownikow,59448,0,1.html",Polska adaptacja Skali Bólu Psychicznego Ronalda Holdena i współpracowników,2017,51,2,369-381,https://doi.org/10.12740/PP/OnlineFirst/59448,ARTICLE
"https://www.psychiatriapolska.pl/List-do-Redakcji-W-poszukiwaniu-definicji-procesu-psychotycznego-refleksje-i-watpliwosci,69387,0,1.html",List do Redakcji. W poszukiwaniu definicji „procesu psychotycznego” – refleksje i wątpliwości,2017,51,2,383-386,https://doi.org/10.12740/PP/69387,LETTER
"https://www.psychiatriapolska.pl/Od-Redakcji,68707,0,1.html",Od Redakcji,2017,51,1,3-4,https://doi.org/10.12740/PP/68707,ARTICLE
"https://www.psychiatriapolska.pl/Palmitynian-paliperidonu-skutecznosc-bezpieczenstwo-stosowania-i-miejsce-w-leczeniu-schizofrenii,64581,0,1.html","Palmitynian paliperidonu: skuteczność, bezpieczeństwo stosowania i miejsce w leczeniu schizofrenii",2017,51,1,7-21,https://doi.org/10.12740/PP/64581,ARTICLE
"https://www.psychiatriapolska.pl/Objawy-psychotyczne-jako-powiklanie-przebiegu-leczenia-elektrowstrzasowego-opis-przypadku,62983,0,1.html",Objawy psychotyczne jako powikłanie przebiegu leczenia elektrowstrząsowego – opis przypadku,2017,51,1,23-27,https://doi.org/10.12740/PP/62983,ARTICLE
"https://www.psychiatriapolska.pl/Postawy-polskich-psychiatrow-wobec-osob-chorujacych-psychicznie,62400,0,1.html",Postawy polskich psychiatrów wobec osób chorujących psychicznie,2017,51,1,29-44,https://doi.org/10.12740/PP/62400,ARTICLE
"https://www.psychiatriapolska.pl/Wplyw-wczesnej-psychospolecznej-interwencji-na-odlegle-kliniczne-wyniki-leczenia-osob-chorujacych-na-schizofrenie,61903,0,1.html",Wpływ wczesnej psychospołecznej interwencji na odległe kliniczne wyniki leczenia osób chorujących na schizofrenię,2017,51,1,45-61,https://doi.org/10.12740/PP/61903,ARTICLE
"https://www.psychiatriapolska.pl/Czynniki-ryzyka-objawow-lekowych-i-depresyjnych-u-kobiet-doswiadczajacych-przemocy-w-zwiazku-intymnym,64193,0,1.html",Czynniki ryzyka objawów lękowych i depresyjnych u kobiet doświadczających przemocy w związku intymnym,2017,51,1,63-74,https://doi.org/10.12740/PP/64193,ARTICLE
"https://www.psychiatriapolska.pl/Problemy-seksualne-u-mezczyzn-homo-i-biseksualnych-omowienie-kontekstu-zagadnienia,61799,0,1.html",Problemy seksualne u mężczyzn homo- i biseksualnych – omówienie kontekstu zagadnienia,2017,51,1,75-83,https://doi.org/10.12740/PP/61799,ARTICLE
"https://www.psychiatriapolska.pl/Dysfunkcje-seksualne-mezczyzn-nieheteroseksualnych-analiza-i-krytyka-pismiennictwa,63768,0,1.html",Dysfunkcje seksualne mężczyzn nieheteroseksualnych – analiza i krytyka piśmiennictwa,2017,51,1,85-94,https://doi.org/10.12740/PP/63768,ARTICLE
"https://www.psychiatriapolska.pl/Sexual-Addiction-Screening-Test-polska-adaptacja,61414,0,1.html",Sexual Addiction Screening Test - polska adaptacja,2017,51,1,95-115,https://doi.org/10.12740/PP/OnlineFirst/61414,ARTICLE
"https://www.psychiatriapolska.pl/Zespol-uporczywego-pobudzenia-genitaliow-opis-przypadku,64869,0,1.html",Zespół uporczywego pobudzenia genitaliów – opis przypadku,2017,51,1,117-124,https://doi.org/10.12740/PP/64869,ARTICLE
"https://www.psychiatriapolska.pl/Bariery-w-dostepie-do-leczenia-w-poradniach-terapii-uzaleznienia-od-alkoholu-w-miescie-i-malej-miejscowosci,60345,0,1.html",Bariery w dostępie do leczenia w poradniach terapii uzależnienia od alkoholu w mieście i małej miejscowości,2017,51,1,125-138,https://doi.org/10.12740/PP/60345,ARTICLE
"https://www.psychiatriapolska.pl/Sieci-spoleczne-i-poziom-funkcjonowania-spolecznego-uczestnikow-warsztatow-terapii-zajeciowej-i-srodowiskowych-domow-samopomocy-dwoch-podstawowych-placowek-wsparcia-dla-osob-chorujacych-psychicznie,62080,0,1.html",Sieci społeczne i poziom funkcjonowania społecznego uczestników warsztatów terapii zajęciowej i środowiskowych domów samopomocy – dwóch podstawowych placówek wsparcia dla osób chorujących psychicznie,2017,51,1,139-152,https://doi.org/10.12740/PP/62080,ARTICLE
"https://www.psychiatriapolska.pl/List-do-redakcji-Depresja-i-cytokiny-inne-spojrzenie-Odpowiedz-autora,66788,0,1.html",List do redakcji. Depresja i cytokiny – inne spojrzenie. Odpowiedź autora,2017,51,1,153-154,https://doi.org/10.12740/PP/66788,LETTER
"https://www.psychiatriapolska.pl/Recenzja-Grzegorz-Iniewicz-Stres-mniejszosciowy-u-osob-biseksualnych-i-homoseksualnych-W-poszukiwaniu-czynnikow-ryzyka-i-czynnikow-chroniacych,64244,0,1.html",Recenzja. Grzegorz Iniewicz. Stres mniejszościowy u osób biseksualnych i homoseksualnych. W poszukiwaniu czynników ryzyka i czynników chroniących,2017,51,1,155-157,https://doi.org/10.12740/PP/64244,
"https://www.psychiatriapolska.pl/Od-Redakcji,67862,0,1.html",Od Redakcji,2016,50,6,1081-1083,https://doi.org/10.12740/PP/67862,EDITORIAL
"https://www.psychiatriapolska.pl/Kwestionariusz-Hypomania-Checklist-HCL-33-u-polskich-pacjentow-z-choroba-afektywna-dwubiegunowa-badanie-zgodnosci-miedzy-ocena-wlasna-a-ocena-przez-osobe-z-zewnatrz,66358,0,1.html",Kwestionariusz Hypomania Checklist (HCL-33) u polskich pacjentów z chorobą afektywną dwubiegunową – badanie zgodności między oceną własną a oceną przez osobę z zewnątrz,2016,50,6,1085-1092,https://doi.org/10.12740/PP/66358,ARTICLE
"https://www.psychiatriapolska.pl/Przeglad-zachowan-zdrowotnych-i-zachowan-obciazonych-ryzykiem-problemow-ze-zdrowiem-psychicznym-i-zachowan-samobojczych-u-mlodych-Europejczykow-na-podstawie-wynikow-badania-SEYLE-finansowanego-przez-UE,66954,0,1.html","Przegląd zachowań zdrowotnych i zachowań obciążonych ryzykiem, problemów ze zdrowiem psychicznym i zachowań samobójczych u młodych Europejczyków na podstawie wyników badania SEYLE finansowanego przez UE",2016,50,6,1093-1107,https://doi.org/10.12740/PP/66954,REVIEW
"https://www.psychiatriapolska.pl/Ocena-depresyjnosci-w-populacji-Psychometryczna-ocena-polskiej-wersji-skali-CESD-R,61614,0,1.html",Ocena depresyjności w populacji. Psychometryczna ocena polskiej wersji skali CESD-R,2016,50,6,1109-1117,https://doi.org/10.12740/PP/61614,ARTICLE
"https://www.psychiatriapolska.pl/Sposob-zywienia-a-zagrozenie-chorobami-ukladu-sercowo-naczyniowego-u-pacjentow-z-zaburzeniami-depresyjnymi-nawracajacymi,62682,0,1.html",Sposób żywienia a zagrożenie chorobami układu sercowo-naczyniowego u pacjentów z zaburzeniami depresyjnymi nawracającymi,2016,50,6,1119-1133,https://doi.org/10.12740/PP/62682,ARTICLE
"https://www.psychiatriapolska.pl/Wystepowanie-depresji-poporodowej-a-jakosc-relacji-w-zwiazku,61569,0,1.html",Występowanie depresji poporodowej a jakość relacji w związku,2016,50,6,1135-1146,https://doi.org/10.12740/PP/61569,ARTICLE
"https://www.psychiatriapolska.pl/Badanie-schizotypii-skala-O-LIFE-Oxford-Liverpool-Inventory-for-Feelings-and-Experiences-u-chorych-na-schizofrenie-i-zaburzenia-afektywne,62335,0,1.html",Badanie schizotypii skalą O-LIFE (Oxford-Liverpool Inventory for Feelings and Experiences) u chorych na schizofrenię i zaburzenia afektywne,2016,50,6,1147-1156,https://doi.org/10.12740/PP/62335,ARTICLE
"https://www.psychiatriapolska.pl/Zaburzenia-psychiczne-w-nieswoistych-zapaleniach-jelit-wspolistniejace-zaburzenia-psychiczne-i-mechanizmy-biologiczne,62382,0,1.html",Zaburzenia psychiczne w nieswoistych zapaleniach jelit – współistniejące zaburzenia psychiczne i mechanizmy biologiczne,2016,50,6,1157-1166,https://doi.org/10.12740/PP/62382,ARTICLE
"https://www.psychiatriapolska.pl/Cechy-osobowosci-poziom-leku-i-style-radzenia-sobie-ze-stresem-u-osob-chorych-na-astme-oskrzelowa-i-przewlekla-obturacyjna-chorobe-pluc-analiza-porownawcza,62726,0,1.html","Cechy osobowości, poziom lęku i style radzenia sobie ze stresem u osób chorych na astmę oskrzelową i przewlekłą obturacyjną chorobę płuc – analiza porównawcza",2016,50,6,1167-1180,https://doi.org/10.12740/PP/62726,ARTICLE
"https://www.psychiatriapolska.pl/Wystepowanie-wybranych-objawow-z-dolnego-odcinka-ukladu-moczowego-u-pacjentow-dziennego-oddzialu-leczenia-zaburzen-nerwicowych,61109,0,1.html",Występowanie wybranych objawów z dolnego odcinka układu moczowego u pacjentów dziennego oddziału leczenia zaburzeń nerwicowych,2016,50,6,1181-1205,https://doi.org/10.12740/PP/OnlineFirst/61109,ARTICLE
"https://www.psychiatriapolska.pl/Zwiazki-wybranych-objawow-z-dolnego-odcinka-ukladu-moczowego-z-kontekstem-biografii-pacjentow-dziennego-oddzialu-leczenia-zaburzen-nerwicowych,61583,0,1.html",Związki wybranych objawów z dolnego odcinka układu moczowego z kontekstem biografii pacjentów dziennego oddziału leczenia zaburzeń nerwicowych,2016,50,6,1207-1234,https://doi.org/10.12740/PP/61583,ARTICLE
"https://www.psychiatriapolska.pl/Lek-zwiazany-ze-skokami-spadochronowymi-przyczyna-zaburzen-rownowagi-red-ox,62457,0,1.html",Lęk związany ze skokami spadochronowymi przyczyną zaburzeń równowagi red-ox,2016,50,6,1235-1250,https://doi.org/10.12740/PP/62457,ARTICLE
"https://www.psychiatriapolska.pl/Genetyka-behawioralna-w-polskim-czasopismiennictwie-w-latach-2000-2014,62690,0,1.html",Genetyka behawioralna w polskim czasopiśmiennictwie w latach 2000–2014,2016,50,6,1251-1271,https://doi.org/10.12740/PP/62690,ARTICLE
"https://www.psychiatriapolska.pl/Recenzja-ksiazki-pod-redakcja-Andrzeja-Cechnickiego-i-Anny-Liberadzkiej-pt-n-Umacnianie-i-zdrowienie-Dac-nadzieje-Wydawnictwo-Uniwersytetu-Jagiellonskiego-Krakow-2015-stron-231-,64101,0,1.html","Recenzja książki pod redakcją Andrzeja Cechnickiego i Anny Liberadzkiej pt. 
„Umacnianie i zdrowienie. Dać nadzieję”. Wydawnictwo Uniwersytetu Jagiellońskiego, Kraków 2015, stron, 231.",2016,50,6,1273-1275,https://doi.org/10.12740/PP/64101,
"https://www.psychiatriapolska.pl/Od-Redakcji,65738,0,1.html",Od Redakcji,2016,50,5,903-904,https://doi.org/10.12740/PP/65738,EDITORIAL
"https://www.psychiatriapolska.pl/PTSD-in-victims-of-terroristic-attacks-a-comparison-with-the-impact-of-other-traumatic-events-on-patients-lives,65742,0,1.html",Zespół stresu pourazowego u ofiar zamachów terrorystycznych – studium porównawcze wpływu wydarzeń traumatycznych na życie pacjentów,2016,50,5,907-921,https://doi.org/10.12740/PP/65742,ARTICLE
"https://www.psychiatriapolska.pl/PTSD-prevalence-among-Polish-World-War-II-survivors,60171,0,1.html","Rozpowszechnienie PTSD wśród osób, które przeżyły II wojnę światową w Polsce",2016,50,5,923-934,https://doi.org/10.12740/PP/OnlineFirst/60171,ARTICLE
"https://www.psychiatriapolska.pl/Powojenne-badania-stresu-pourazowego-w-Krakowie-Czesc-I-Badania-do-1989-roku,58052,0,1.html",Powojenne badania stresu pourazowego w Krakowie. Część I. Badania do 1989 roku,2016,50,5,935-944,https://doi.org/10.12740/PP/OnlineFirst/41232,ARTICLE
"https://www.psychiatriapolska.pl/Powojenne-badania-stresu-pourazowego-w-Krakowie-Czesc-II-Badania-po-1989-roku,58121,0,1.html",Powojenne badania stresu pourazowego w Krakowie. Część II. Badania po 1989 roku,2016,50,5,945-958,https://doi.org/10.12740/PP/OnlineFirst/43659,ARTICLE
"https://www.psychiatriapolska.pl/Pamiec-autobiograficzna-i-jej-znaczenie-w-wybranych-zaburzeniach-psychicznych,58221,0,1.html",Pamięć autobiograficzna i jej znaczenie w wybranych zaburzeniach psychicznych,2016,50,5,959-972,https://doi.org/10.12740/PP/38518,ARTICLE
"https://www.psychiatriapolska.pl/Cechy-osobowosci-u-osob-uzaleznionych-od-alkoholu-w-kontekscie-doswiadczen-przemocy-w-dziecinstwie,60346,0,1.html",Cechy osobowości u osób uzależnionych od alkoholu w kontekście doświadczeń przemocy w dzieciństwie,2016,50,5,973-987,https://doi.org/10.12740/PP/60346,ARTICLE
"https://www.psychiatriapolska.pl/Negatywne-doswiadczenia-dzieciece-a-powstawanie-i-przebieg-choroby-afektywnej-dwubiegunowej,61159,0,1.html",Negatywne doświadczenia dziecięce a powstawanie i przebieg choroby afektywnej dwubiegunowej,2016,50,5,989-1000,https://doi.org/10.12740/PP/61159,ARTICLE
"https://www.psychiatriapolska.pl/Stan-psychiczny-pacjentow-na-etapie-wczesnej-i-poznej-starosci-a-ich-oczekiwania-wobec-lekarza,61408,0,1.html",Stan psychiczny pacjentów na etapie wczesnej i późnej starości a ich oczekiwania wobec lekarza,2016,50,5,1001-1014,https://doi.org/10.12740/PP/61408,ARTICLE
"https://www.psychiatriapolska.pl/Analiza-skutecznosci-i-bezpieczenstwa-zabiegow-elektrowstrzasowych-w-populacjach-przed-i-po-60-roku-zycia,59104,0,1.html",Analiza skuteczności i bezpieczeństwa zabiegów elektrowstrząsowych w populacjach przed i po 60. roku życia,2016,50,5,1015-1026,https://doi.org/10.12740/PP/59104,ARTICLE
"https://www.psychiatriapolska.pl/Funkcjonalnosc-narzadu-zucia-a-poczucie-depresji-u-pacjentow-po-55-roku-zycia-zamieszkalych-w-srodowisku-rodzinnym-i-w-domach-pomocy-spolecznej,58146,0,1.html",Funkcjonalność narządu żucia a poczucie depresji u pacjentów po 55. roku życia zamieszkałych w środowisku rodzinnym i w domach pomocy społecznej,2016,50,5,1027-1038,https://doi.org/10.12740/PP/OnlineFirst/45318,ARTICLE
"https://www.psychiatriapolska.pl/Czy-test-Montreal-Cognitive-Assessment-MoCA-moze-byc-skuteczniejszy-od-powszechnie-stosowanego-Mini-Mental-State-Examination-MMSE-w-wykrywaniu-lagodnych-zaburzen-funkcji-poznawczych-u-osob-po-60-roku-zycia-Metaanaliza,58119,0,1.html",Czy test Montreal Cognitive Assessment (MoCA) może być skuteczniejszy od powszechnie stosowanego Mini-Mental State Examination (MMSE) w wykrywaniu łagodnych zaburzeń funkcji poznawczych u osób po 60. roku życia? Metaanaliza,2016,50,5,1039-1052,https://doi.org/10.12740/PP/45368,ARTICLE
"https://www.psychiatriapolska.pl/Znieksztalcenia-poznawcze-u-sprawcow-wykorzystania-seksualnego-dziecka-Konceptualizacje-pojecia-,58254,0,1.html",Zniekształcenia poznawcze u sprawców wykorzystania seksualnego dziecka. Konceptualizacje pojęcia.,2016,50,5,1053-1063,https://doi.org/10.12740/PP/37470,ARTICLE
"https://www.psychiatriapolska.pl/Psychoonkologia-w-Polsce,60906,0,1.html",Psychoonkologia w Polsce,2016,50,5,1065-1073,https://doi.org/10.12740/PP/60906,ARTICLE
"https://www.psychiatriapolska.pl/Od-Redakcji,64495,0,1.html",Od Redakcji,2016,50,4,675-676,https://doi.org/10.12740/PP/64495,EDITORIAL
"https://www.psychiatriapolska.pl/Przeglad-metod-leczenia-behawioralnych-i-psychologicznych-symptomow-otepienia-BPSD-,64477,0,1.html",Przegląd metod leczenia behawioralnych i psychologicznych symptomów otępienia (BPSD),2016,50,4,679-715,https://doi.org/10.12740/PP/64477,ARTICLE
"https://www.psychiatriapolska.pl/Etapy-przebiegu-schizofrenii-koncepcja-stagingu,58723,0,1.html",Etapy przebiegu  schizofrenii - koncepcja stagingu,2016,50,4,717-730,https://doi.org/10.12740/PP/58723,ARTICLE
"https://www.psychiatriapolska.pl/Poczucie-wlasnosci-ciala-u-osob-ze-schizofrenia-badania-w-paradygmacie-Iluzji-Gumowej-Reki,58140,0,1.html",Poczucie własności ciała u osób ze schizofrenią: badania w paradygmacie Iluzji Gumowej Ręki,2016,50,4,731-740,https://doi.org/10.12740/PP/44964,ARTICLE
"https://www.psychiatriapolska.pl/Czy-iluzja-wkleslej-maski-rzeczywiscie-jest-testem-na-schizofrenie-,60150,0,1.html",Czy iluzja wklęsłej maski rzeczywiście jest testem na schizofrenię?,2016,50,4,741-745,https://doi.org/10.12740/PP/60150,ARTICLE
"https://www.psychiatriapolska.pl/Znaczenie-zaburzenia-osi-jelitowo-mozgowej-i-nadwrazliwosci-na-antygeny-pokarmowe-w-etiopatogenezie-schizofrenii-,58111,0,1.html",Znaczenie zaburzenia osi jelitowo-mózgowej i nadwrażliwości na antygeny pokarmowe w etiopatogenezie schizofrenii.,2016,50,4,747-760,https://doi.org/10.12740/PP/OnlineFirst/45053,ARTICLE
"https://www.psychiatriapolska.pl/Badania-rodzinne-polimorfizmow-genu-transformujacego-czynnika-wzrostu-beta1-Transforming-Growth-Factor-Beta1-TGFB1-w-schizofrenii,61273,0,1.html","Badania rodzinne polimorfizmów genu transformującego czynnika wzrostu beta1 (Transforming Growth Factor Beta1, TGFB1) w schizofrenii",2016,50,4,761-770,https://doi.org/10.12740/PP/61273,ARTICLE
"https://www.psychiatriapolska.pl/Znaczenie-cech-osobowosci-pacjenta-chorujacego-na-schizofrenie-i-jego-terapeuty-dla-relacji-terapeutycznej-,58092,0,1.html",Znaczenie cech osobowości pacjenta chorującego na schizofrenię i jego terapeuty dla relacji terapeutycznej.,2016,50,4,771-786,https://doi.org/10.12740/PP/44189,ARTICLE
"https://www.psychiatriapolska.pl/Skutecznosc-treningu-metapoznawczego-u-osob-chorujacych-na-schizofrenie-narracyjny-przeglad-systematyczny-badan-opublikowanych-w-latach-2009-2015-,59113,0,1.html",Skuteczność treningu metapoznawczego u osób chorujących na schizofrenię: narracyjny przegląd systematyczny badań opublikowanych w latach 2009–2015.,2016,50,4,787-803,https://doi.org/10.12740/PP/59113,ARTICLE
"https://www.psychiatriapolska.pl/Aktywnosc-zawodowa-w-procesie-zdrowienia-interpretacyjna-analiza-fenomenologiczna-doswiadczen-pacjentow-ze-spektrum-schizofrenii,58113,0,1.html",Aktywność zawodowa w procesie zdrowienia – interpretacyjna analiza fenomenologiczna doświadczeń pacjentów ze spektrum schizofrenii,2016,50,4,805-826,https://doi.org/10.12740/PP/44238,ARTICLE
"https://www.psychiatriapolska.pl/Depresja-z-cechami-atypowymi-w-roznych-rodzajach-zaburzen-afektywnych,58099,0,1.html",Depresja z cechami atypowymi w różnych rodzajach zaburzeń afektywnych,2016,50,4,827-838,https://doi.org/10.12740/PP/44680,ARTICLE
"https://www.psychiatriapolska.pl/Zmiany-neurochemiczne-w-przednim-zakrecie-obreczy-w-zaburzeniu-afektywnym-dwubiegunowym-spektroskopia-protonowa-rezonansu-magnetycznego-1H-MRS-,58749,0,1.html",Zmiany neurochemiczne w przednim zakręcie obręczy w zaburzeniu afektywnym dwubiegunowym: spektroskopia protonowa rezonansu magnetycznego (1H-MRS),2016,50,4,839-848,https://doi.org/10.12740/PP/58749,ARTICLE
"https://www.psychiatriapolska.pl/Bialko-S100B-jako-potencjalny-marker-w-zaburzeniach-afektywnych,62393,0,1.html",Białko S100B jako potencjalny marker w zaburzeniach afektywnych,2016,50,4,849-857,https://doi.org/10.12740/PP/62393,ARTICLE
"https://www.psychiatriapolska.pl/Czestosc-wystepowania-zaburzen-depresyjnych-w-grupie-zawodowych-kierowcow-subanaliza-epidemiologiczna-badania-RACER-,58116,0,1.html",Częstość występowania zaburzeń depresyjnych w grupie zawodowych kierowców – subanaliza epidemiologiczna badania RACER.,2016,50,4,859-871,https://doi.org/10.12740/PP/44395,ARTICLE
"https://www.psychiatriapolska.pl/Umacnianie-rodzin-z-doswiadczeniem-choroby-psychicznej-Prezentacja-polskiej-wersji-pakietu-szkoleniowego-CAMILLE,59312,0,1.html",Umacnianie rodzin z doświadczeniem choroby psychicznej. Prezentacja polskiej wersji pakietu szkoleniowego CAMILLE,2016,50,4,873-883,https://doi.org/10.12740/PP/59312,ARTICLE
"https://www.psychiatriapolska.pl/Letter-to-Editor-Depression-and-cytokines-a-different-perspective,60758,0,1.html",List do Redakcji. Depresja i cytokiny – inne spojrzenie,2016,50,4,885-886,https://doi.org/10.12740/PP/60758,LETTER
"https://www.psychiatriapolska.pl/List-do-Redakcji-Architektura-szpitali-psychiatrycznych-wybrane-problemy-istniejacego-stanu-infrastruktury,62572,0,1.html",List do Redakcji. Architektura szpitali psychiatrycznych – wybrane problemy istniejącego stanu infrastruktury,2016,50,4,887-890,https://doi.org/10.12740/PP/62572,LETTER
"https://www.psychiatriapolska.pl/List-do-Redakcji-Kiedy-i-gdzie-urodzila-sie-dr-Ludwika-Karpinska-Woyczynska-,64102,0,1.html",List do Redakcji. Kiedy i gdzie urodziła się dr Ludwika Karpińska-Woyczyńska?,2016,50,4,891-893,https://doi.org/10.12740/PP/64102,LETTER
"https://www.psychiatriapolska.pl/Bartosz-Grabski-PODSTAWY-BADANIA-PSYCHIATRYCZNEGO-DLA-STUDENTOW-LEKARZY-PSYCHOLOGOW-I-PSYCHOTERAPEUTOW,63339,0,1.html","Bartosz Grabski: PODSTAWY BADANIA PSYCHIATRYCZNEGO DLA STUDENTÓW, LEKARZY, PSYCHOLOGÓW I PSYCHOTERAPEUTÓW",2016,50,4,895-896,https://doi.org/10.12740/PP/63339,EDITORIAL
"https://www.psychiatriapolska.pl/Od-Redakcji,63177,0,1.html",Od Redakcji,2016,50,3,483-484,https://doi.org/10.12740/PP/63177,EDITORIAL
"https://www.psychiatriapolska.pl/Polski-projekt-rejestru-sprawcow-przestepstw-na-tle-seksualnym-perspektywa-specjalistow-ds-zdrowia-psychicznego,62903,0,1.html",Polski projekt rejestru sprawców przestępstw na tle seksualnym – perspektywa specjalistów ds. zdrowia psychicznego,2016,50,3,487-496,https://doi.org/10.12740/PP/62903,ARTICLE
"https://www.psychiatriapolska.pl/Niespecyficzne-zaburzenia-odzywiania-sie-subiektywny-przeglad-,59217,0,1.html",Niespecyficzne zaburzenia odżywiania się - subiektywny przegląd.,2016,50,3,497-507,https://doi.org/10.12740/PP/59217,REVIEW
"https://www.psychiatriapolska.pl/Zaburzenia-mineralizacji-kosci-jako-powiklanie-jadlowstretu-psychicznego-etiologia-rozpowszechnienie-przebieg-i-leczenie,59289,0,1.html","Zaburzenia mineralizacji kości jako powikłanie jadłowstrętu psychicznego – etiologia, rozpowszechnienie, przebieg i leczenie",2016,50,3,509-520,https://doi.org/10.12740/PP/59289,ARTICLE
"https://www.psychiatriapolska.pl/Zmiany-w-jamie-ustnej-w-przebiegu-intensywnych-wymiotow-u-pacjentki-z-zaburzeniem-wegetatywnym-wystepujacym-pod-postacia-somatyczna-opis-przypadku-,58933,0,1.html",Zmiany w jamie ustnej w przebiegu intensywnych wymiotów u pacjentki z zaburzeniem wegetatywnym występującym pod postacią somatyczną – opis przypadku.,2016,50,3,521-531,https://doi.org/10.12740/PP/OnlineFirst/58933,ARTICLE
"https://www.psychiatriapolska.pl/Zaburzenia-procesow-spolecznego-poznania-w-zespole-Aspergera-i-jadlowstrecie-psychicznym-W-poszukiwaniu-endofenotypow-spolecznego-poznania,58218,0,1.html",Zaburzenia procesów społecznego poznania w zespole Aspergera i jadłowstręcie psychicznym. W poszukiwaniu endofenotypów społecznego poznania,2016,50,3,533-542,https://doi.org/10.12740/PP/OnlineFirst/33485,ARTICLE
"https://www.psychiatriapolska.pl/Znaczenie-czynnikow-genetycznych-oraz-przed-i-okoloporodowych-w-etiologii-zaburzen-ze-spektrum-autyzmu-wskazania-do-konsultacji-genetycznej,57999,0,1.html",Znaczenie czynników genetycznych oraz przed- i okołoporodowych w etiologii zaburzeń ze spektrum autyzmu – wskazania do konsultacji genetycznej,2016,50,3,543-554,https://doi.org/10.12740/PP/43234,ARTICLE
