url,title,year,volume,issue,pages,doi,article_type
"https://www.psychiatriapolska.pl/Between-self-stigma-and-the-will-of-recovery-Difficulties-in-accepting-a-psychiatric,124774,0,1.html","Pomiędzy self-stygmą a wolą zdrowienia... Trudności z akceptacją diagnozy psychiatrycznej 
– studium przypadku",2022,56,1,183-193,https://doi.org/10.12740/PP/OnlineFirst/124774,
"https://www.psychiatriapolska.pl/Editorial,145349,0,1.html",Od Redakcji,2021,55,6,1203-1204,https://doi.org/10.12740/PP/145349,
"https://www.psychiatriapolska.pl/Cause-specific-mortality-and-risk-factors-of-death-among-inpatients-of-a-psychiatric,122356,0,1.html",Umieralność szczegółowa i czynniki ryzyka zgonu wśród pacjentów szpitala psychiatrycznego,2021,55,6,1207-1219,https://doi.org/10.12740/PP/122356,ARTICLE
"https://www.psychiatriapolska.pl/Activity-of-selected-metalloproteinases-in-neurodegenerative-diseases-of-the-central,126662,0,1.html",Aktywność wybranych metaloproteinaz w chorobach neurodegeneracyjnych ośrodkowego układu nerwowego na przykładzie otępienia i schizofrenii,2021,55,6,1221-1233,https://doi.org/10.12740/PP/126662,ARTICLE
"https://www.psychiatriapolska.pl/Psychopathic-traits-and-empathy-moral-decision-making-and-complex-affect-expression,120939,0,1.html",Nasilenie cech psychopatycznych a empatia: podejmowanie decyzji moralnych i rozpoznawanie złożonej ekspresji mimicznej,2021,55,6,1235-1255,https://doi.org/10.12740/PP/120939,ARTICLE
"https://www.psychiatriapolska.pl/Polish-adaptation-and-validation-of-the-Mentalization-Scale-MentS-a-self-report-measure,125383,0,1.html",Polska adaptacja i walidacja Skali mentalizacji (MentS) – samoopisowego narzędzia do pomiaru mentalizowania,2021,55,6,1257-1274,https://doi.org/10.12740/PP/125383,ARTICLE
"https://www.psychiatriapolska.pl/Polish-Validation-of-the-Internet-Gaming-Disorder-20-IGD-20-Test,125656,0,1.html","Badanie walidacyjne polskiej wersji kwestionariusza Zaburzenie Grania w Internecie-20 (Internet Gaming Disorder-20, IGD-20)",2021,55,6,1275-1292,https://doi.org/10.12740/PP/125656,ARTICLE
"https://www.psychiatriapolska.pl/The-Polish-adaptation-of-the-Disclosure-of-Trauma-Questionnaire-DTQ-,122501,0,1.html",Polska adaptacja Kwestionariusza Ujawnienia Traumy (DTQ),2021,55,6,1293-1304,https://doi.org/10.12740/PP/OnlineFirst/122501,ARTICLE
"https://www.psychiatriapolska.pl/Polish-Version-of-Lars-Tornstam-s-Gerotranscendence-Scale-Type-2-GST2-PL-,120790,0,1.html",Polska wersja Skali gerotranscendencji Typu 2 Larsa Tornstama (GST2-PL),2021,55,6,1305-1325,https://doi.org/10.12740/PP/120790,ARTICLE
"https://www.psychiatriapolska.pl/Memory-in-Polish-multiple-sclerosis-patients-correlations-with-mood-and-fatigue,125747,0,1.html",Pamięć u polskich pacjentów ze stwardnieniem rozsianym – korelacje z nastrojem i zespołem zmęczenia,2021,55,6,1327-1339,https://doi.org/10.12740/PP/125747,ARTICLE
"https://www.psychiatriapolska.pl/Review-of-studies-on-the-impact-of-climbing-as-a-complementary-form-of-depression,126445,0,1.html",Przegląd prac dotyczących wpływu wspinaczki jako uzupełniającej formy leczenia depresji i ich ocena według narzędzia QUADAS-2,2021,55,6,1341-1356,https://doi.org/10.12740/PP/126445,ARTICLE
"https://www.psychiatriapolska.pl/Can-t-get-enough-Addiction-to-physical-exercises-phenomenon-diagnostic-criteria-etiology,127499,0,1.html","Co za dużo to niezdrowo. Uzależnienie od ćwiczeń fizycznych: zjawisko, kryteria diagnostyczne, etiologia, terapia, wyzwania badawcze",2021,55,6,1357-1372,https://doi.org/10.12740/PP/127499,ARTICLE
"https://www.psychiatriapolska.pl/Weak-central-coherence-construct-conception-development-research-methods,120931,0,1.html","Słaba centralna koherencja – rozwój i koncepcja konstruktu, metody badania",2021,55,6,1373-1386,https://doi.org/10.12740/PP/OnlineFirst/120931,ARTICLE
"https://www.psychiatriapolska.pl/Psychiatric-behavioral-and-emotional-disorders-in-Polish-children-and-adolescents,121980,0,1.html","Zaburzenia psychiczne, behawioralne i emocjonalne u dzieci i młodzieży z wrodzonym zakażeniem HIV w Polsce",2021,55,6,1387-1404,https://doi.org/10.12740/PP/OnlineFirst/121980,ARTICLE
"https://www.psychiatriapolska.pl/Own-body-experience-and-parents-attitudes-perceived-retrospectively-in-patients-with,122031,0,1.html",Doświadczenie własnego ciała i retrospektywnie postrzegany postawy rodziców u pacjentów z zespołem jelita drażliwego,2021,55,6,1405-1420,https://doi.org/10.12740/PP/OnlineFirst/122031,ARTICLE
"https://www.psychiatriapolska.pl/Comorbidity-of-bipolar-disorder-and-autism-spectrum-disorder-review-paper,122350,0,1.html",Współwystępowanie choroby afektywnej dwubiegunowej i zaburzeń ze spektrum autyzmu – przegląd badań,2021,55,6,1421-1431,https://doi.org/10.12740/PP/OnlineFirst/122350,REVIEW
"https://www.psychiatriapolska.pl/Emotion-regulation-in-binge-eating-disorder,122212,0,1.html",Regulacja emocji w zaburzeniu z napadami objadania się,2021,55,6,1433-1448,https://doi.org/10.12740/PP/OnlineFirst/122212,ARTICLE
"https://www.psychiatriapolska.pl/Clinical-complexity-where-to-find-it-and-how-to-use-it,126595,0,1.html",Kompleksowość kliniczna – gdzie ją znaleźć i jak ją wykorzystywać,2021,55,6,1449-1471,https://doi.org/10.12740/PP/OnlineFirst/126595,ARTICLE
"https://www.psychiatriapolska.pl/Letter-to-the-Editor-The-Polish-standard-of-teleconsultation-in-psychiatry,142523,0,1.html",List do Redakcji. Polski standard teleporady w psychiatrii,2021,55,6,1473-1477,https://doi.org/10.12740/PP/142523,LETTER
"https://www.psychiatriapolska.pl/Editorial,143590,0,1.html",Od Redakcji,2021,55,5,937-938,https://doi.org/10.12740/PP/143596,EDITORIAL
"https://www.psychiatriapolska.pl/The-position-statement-of-the-Working-Group-of-the-Polish-Psychiatric-Association,138177,0,1.html",Stanowisko grupy roboczej Polskiego Towarzystwa Psychiatrycznego na temat stosowania częściowych agonistów receptorów dopaminowych D2/D3 w leczeniu zaburzeń psychicznych,2021,55,5,941-966,https://doi.org/10.12740/PP/138177,ARTICLE
"https://www.psychiatriapolska.pl/The-position-statement-of-the-Working-Group-of-the-Polish-Psychiatric-Association,140287,0,1.html",Stanowisko grupy roboczej Polskiego Towarzystwa Psychiatrycznego na temat stosowania częściowych agonistów receptorów dopaminowych D2/D3 w populacjach szczególnych,2021,55,5,967-987,https://doi.org/10.12740/PP/140287,ARTICLE
"https://www.psychiatriapolska.pl/Analysis-of-psychiatric-consultations-in-the-department-of-neurology-and-stroke-unit,116320,0,1.html",Analiza konsultacji psychiatrycznych w oddziale neurologii i oddziale udarowym: rozpoznania i terapia,2021,55,5,989-1000,https://doi.org/10.12740/PP/OnlineFirst/116320,ARTICLE
"https://www.psychiatriapolska.pl/A-case-of-reversible-aphasia-type-speech-disorders-after-treatment-with-quetiapine,115218,0,1.html",Odwracalna afazja po leczeniu kwetiapiną – opis przypadku,2021,55,5,1001-1008,https://doi.org/10.12740/PP/OnlineFirst/115218,ARTICLE
"https://www.psychiatriapolska.pl/The-dyadic-coping-model-of-bipolar-disorder-patients,118840,0,1.html",Model diadycznego radzenia sobie ze stresem pacjentów z chorobą afektywną dwubiegunową,2021,55,5,1009-1024,https://doi.org/10.12740/PP/OnlineFirst/118840,ARTICLE
"https://www.psychiatriapolska.pl/The-significance-of-physical-activity-in-the-prevention-of-depressive-disorders,118054,0,1.html",Znaczenie aktywności fizycznej w prewencji zaburzeń depresyjnych,2021,55,5,1025-1046,https://doi.org/10.12740/PP/OnlineFirst/118054,ARTICLE
"https://www.psychiatriapolska.pl/Chronic-fatigue-of-nurses-in-view-of-the-challenges-of-contemporary-psychiatric-care,118480,0,1.html",Zmęczenie przewlekłe pielęgniarek w obliczu wyzwań współczesnej opieki psychiatrycznej. Czy temperament i środowisko pracy mają znaczenie?,2021,55,5,1047-1064,https://doi.org/10.12740/PP/OnlineFirst/118480,ARTICLE
"https://www.psychiatriapolska.pl/The-relationship-between-eating-patterns-body-image-and-emotional-dysregulation-similarities,118816,0,1.html","Związek między zachowaniami żywieniowymi, obrazem ciała a dysregulacją emocjonalną: podobieństwa między osobami z nadmierną i prawidłową masą ciała",2021,55,5,1065-1078,https://doi.org/10.12740/PP/118816,ARTICLE
"https://www.psychiatriapolska.pl/Anorexia-Readiness-Syndrome-about-the-need-for-early-detection-of-dietary-restrictions,120411,0,1.html",Syndrom gotowości anorektycznej – o potrzebie wczesnego rozpoznania restrykcji żywieniowych. Wyniki badań pilotażowych,2021,55,5,1079-1091,https://doi.org/10.12740/PP/120411,ARTICLE
"https://www.psychiatriapolska.pl/Frequency-of-gastroesophageal-reflux-disease-in-adolescent-girls-with-anorexia-nervosa,118269,0,1.html",Częstość choroby refluksowej u pacjentek z jadłowstrętem psychicznym,2021,55,5,1093-1100,https://doi.org/10.12740/PP/OnlineFirst/118269,ARTICLE
"https://www.psychiatriapolska.pl/Patterns-of-synthetic-cathinones-use-and-their-impact-on-depressive-symptoms-and,115170,0,1.html",Wzory stosowania syntetycznych katynonów a objawy depresyjne i parafunkcyjne zachowania ustne,2021,55,5,1101-1119,https://doi.org/10.12740/PP/OnlineFirst/115170,ARTICLE
"https://www.psychiatriapolska.pl/A-shortened-version-of-the-Indirect-Self-Destructiveness-Scale-ISDS-25,118006,0,1.html",Skrócona wersja Skali pośredniej autodestruktywności PAD-25,2021,55,5,1121-1137,https://doi.org/10.12740/PP/118006,ARTICLE
"https://www.psychiatriapolska.pl/Assessment-of-criterion-validity-of-personality-disorder-diagnosis-in-adolescents,119778,0,1.html",Ocena trafności kryterialnej diagnozy zaburzeń osobowości u młodzieży oraz związków między stylem przywiązania a rozpoznaniem zaburzeń osobowości,2021,55,5,1139-1155,https://doi.org/10.12740/PP/OnlineFirst/119778,ARTICLE
"https://www.psychiatriapolska.pl/Psychopathic-traits-psychological-resilience-and-coping-with-stress-in-socially-maladjusted,118139,0,1.html","Cechy psychopatyczne, prężność psychiczna i radzenie sobie ze stresem u młodzieży niedostosowanej społecznie",2021,55,5,1157-1167,https://doi.org/10.12740/PP/OnlineFirst/118139,ARTICLE
"https://www.psychiatriapolska.pl/Participation-of-an-expert-psychologist-in-the-interrogation-of-a-witness-in-the,120655,0,1.html",Udział biegłego psychologa w przesłuchaniu świadka w świetle polskiego prawa karnego,2021,55,5,1169-1181,https://doi.org/10.12740/PP/OnlineFirst/120655,ARTICLE
"https://www.psychiatriapolska.pl/A-letter-to-the-Editor-Documented-persistent-lack-of-cooperation-during-treatment,141640,0,1.html",List do Redakcji. Udokumentowany uporczywy brak współpracy podczas leczenia schizofrenii – rekomendacje Konsultanta Krajowego ds. Psychiatrii,2021,55,5,1183-1185,https://doi.org/10.12740/PP/141640,LETTER
"https://www.psychiatriapolska.pl/A-letter-to-the-Editor-International-initiatives-focusing-on-training-in-the-use,144243,0,1.html",List do Redakcji. Międzynarodowe inicjatywy w zakresie szkolenia w użytkowaniu rozdziału ICD-11 dotyczącego zaburzeń psychicznych,2021,55,5,1187-1189,https://doi.org/10.12740/PP/144243,LETTER
"https://www.psychiatriapolska.pl/A-letter-to-the-editor-Three-vote-on-the-National-Mental-Health-Programme,133286,0,1.html",List do Redakcji. Trójgłos w sprawie Narodowego Programu Ochrony Zdrowia Psychicznego,2021,55,5,1191-1195,https://doi.org/10.12740/PP/133286,LETTER
"https://www.psychiatriapolska.pl/Editorial,141950,0,1.html",Od Redakcji,2021,55,4,715-716,https://doi.org/10.12740/PP/141950,EDITORIAL
"https://www.psychiatriapolska.pl/Polish-Psychiatric-Association-consensus-statement-on-non-pharmacological-methods,135527,0,1.html",Stanowisko grupy roboczej PTP na temat stosowania metod niefarmakologicznych w leczeniu objawów negatywnych schizofrenii,2021,55,4,719-742,https://doi.org/10.12740/PP/OnlineFirst/135527,ARTICLE
"https://www.psychiatriapolska.pl/Legal-and-medical-aspects-associated-with-the-use-of-direct-coercion-by-emergency,120530,0,1.html",Prawno-medyczne aspekty zastosowania przymusu bezpośredniego przez zespoły ratownictwa medycznego w świetle obowiązującego prawa,2021,55,4,757-767,https://doi.org/10.12740/PP/120530,ARTICLE
"https://www.psychiatriapolska.pl/Progress-and-stumbling-blocks-in-the-discovery-of-biological-and-genetic-basis-of,116884,0,1.html",Postępy i trudności w identyfikacji biologicznych i genetycznych przyczyn zespołu nadpobudliwości psychoruchowej z deficytem uwagi (ADHD),2021,55,4,769-786,https://doi.org/10.12740/PP/116884,ARTICLE
"https://www.psychiatriapolska.pl/Diagnostic-errors-in-autism-spectrum-disorder-and-their-consequences-case-studies,111789,0,1.html",Błędy diagnostyczne w zaburzeniach ze spektrum autyzmu i ich konsekwencje – opisy przypadków,2021,55,4,787-799,https://doi.org/10.12740/PP/OnlineFirst/111789,ARTICLE
"https://www.psychiatriapolska.pl/Theory-of-Mind-deficits-in-childhood-mental-and-neurodevelopmental-disorders,112708,0,1.html",Deficyty Teorii Umysłu w wybranych zaburzeniach psychicznych wieku rozwojowego,2021,55,4,801-813,https://doi.org/10.12740/PP/OnlineFirst/112708,ARTICLE
"https://www.psychiatriapolska.pl/Families-of-people-with-Marfan-syndrome-The-relationship-between-the-functioning,114838,0,1.html",Rodzina osoby z zespołem Marfana. Związki funkcjonowania systemu rodzinnego z jakością życia osoby chorej,2021,55,4,815-834,https://doi.org/10.12740/PP/OnlineFirst/114838,ARTICLE
"https://www.psychiatriapolska.pl/Experience-of-courtesy-stigma-among-relatives-of-individuals-with-schizophrenia-a,114972,0,1.html",Doświadczenie piętna przeniesionego wśród krewnych osób ze schizofrenią – badanie jakościowe,2021,55,4,835-850,https://doi.org/10.12740/PP/OnlineFirst/114972,ARTICLE
"https://www.psychiatriapolska.pl/Thomas-Szasz-The-uncompromising-rebel-and-critic-of-psychiatry,125902,0,1.html",Thomas Szasz: bezkompromisowy buntownik i krytyk psychiatrii,2021,55,4,851-867,https://doi.org/10.12740/PP/125902,ARTICLE
"https://www.psychiatriapolska.pl/Heterogeneity-of-cognitive-profiles-in-students-with-borderline-intellectual-functioning,123165,0,1.html",Heterogeniczność profili poznawczych uczniów z inteligencją niższą niż przeciętna,2021,55,4,869-885,https://doi.org/10.12740/PP/123165,ARTICLE
"https://www.psychiatriapolska.pl/Parafunctions-Signs-and-Symptoms-of-Temporomandibular-Disorders-TMD-in-Children-with,113438,0,1.html","Parafunkcje, oznaki i objawy zaburzeń czynnościowych narządu żucia (TMD) u dzieci z zespołem nadpobudliwości psychoruchowej z deficytem uwagi (ADHD).",2021,55,4,887-900,https://doi.org/10.12740/PP/OnlineFirst/113438,ARTICLE
"https://www.psychiatriapolska.pl/Well-being-among-PhD-candidates,114121,0,1.html",Dobrostan psychofizyczny wśród doktorantów,2021,55,4,901-914,https://doi.org/10.12740/PP/OnlineFirst/114121,ARTICLE
"https://www.psychiatriapolska.pl/The-role-of-emotional-eating-and-BMI-in-the-context-of-chocolate-consumption-and,116515,0,1.html",Rola jedzenia emocjonalnego i wskaźnika BMI w kontekście konsumpcji czekolady i unikania sytuacji związanych z ekspozycją ciała u kobiet z prawidłową masą ciała,2021,55,4,915-930,https://doi.org/10.12740/PP/116515,ARTICLE
"https://www.psychiatriapolska.pl/Editorial,140082,0,1.html",Od Redakcji,2021,55,3,477-478,https://doi.org/10.12740/PP/140082,EDITORIAL
"https://www.psychiatriapolska.pl/Etiopathogenesis-of-bipolar-affective-disorder-the-state-of-the-art-for-2021,132961,0,1.html",Etiopatogeneza choroby afektywnej dwubiegunowej – stan wiedzy na rok 2021,2021,55,3,481-496,https://doi.org/10.12740/PP/132961,ARTICLE
"https://www.psychiatriapolska.pl/The-occurrence-of-anxiety-disorders-among-Poles-during-the-COVID-19-pandemic-,126230,0,1.html",Występowanie zaburzeń lękowych wśród Polaków w dobie pandemii COVID–19,2021,55,3,497-509,https://doi.org/10.12740/PP/OnlineFirst/126230,ARTICLE
"https://www.psychiatriapolska.pl/Type-1-Diabetes-and-COVID-19-the-level-of-anxiety-stress-and-the-general-mental-health,133356,0,1.html","Cukrzyca typu 1 i COVID-19: poziom lęku, stresu i ogólnego stanu zdrowia psychicznego u pacjentów w porównaniu z grupą kontrolną",2021,55,3,511-523,https://doi.org/10.12740/PP/OnlineFirst/133356,ARTICLE
"https://www.psychiatriapolska.pl/Relationship-of-metabolic-parameters-with-the-course-of-the-first-episode-of-psychosis,119021,0,1.html",Związek parametrów metabolicznych z przebiegiem pierwszego epizodu psychozy – badania wstępne,2021,55,3,525-540,https://doi.org/10.12740/PP/119021,ARTICLE
"https://www.psychiatriapolska.pl/Improvement-in-clinical-symptoms-in-patients-with-the-first-episode-of-psychosis,131531,0,1.html",Związek poprawy objawów klinicznych u pacjentów z pierwszym epizodem psychozy i jej związek ze spadkiem ogólnoustrojowej dostępności tlenku azotu. Badanie pilotażowe,2021,55,3,541-554,https://doi.org/10.12740/PP/131531,ARTICLE
"https://www.psychiatriapolska.pl/Use-of-transcutaneous-auricular-vagus-nerve-stimulation-taVNS-in-the-treatment-of,115191,0,1.html","Zastosowanie przezskórnej usznej stymulacji nerwu błędnego (taVNS) w leczeniu pacjentów z depresją lekooporną – badanie pilotażowe, prezentacja pięciu przypadków klinicznych",2021,55,3,555-564,https://doi.org/10.12740/PP/OnlineFirst/115191,ARTICLE
"https://www.psychiatriapolska.pl/Transcranial-magnetic-stimulation-TMS-in-treatment-of-psychiatric-disorders-review,115556,0,1.html",Przezczaszkowa stymulacja magnetyczna (TMS) w terapii zaburzeń psychicznych – aktualny przegląd badań,2021,55,3,565-583,https://doi.org/10.12740/PP/OnlineFirst/115556,REVIEW
"https://www.psychiatriapolska.pl/Admission-of-a-minor-to-a-psychiatric-hospital-under-Polish-law-Part-I,127885,0,1.html",Przyjęcie małoletniego do szpitala psychiatrycznego w myśl polskiego prawa. Część I,2021,55,3,585-598,https://doi.org/10.12740/PP/127885,ARTICLE
"https://www.psychiatriapolska.pl/Admission-of-a-minor-to-a-psychiatric-hospital-under-Polish-law-Part-II,127886,0,1.html",Przyjęcie małoletniego do szpitala psychiatrycznego w myśl polskiego prawa. Część II,2021,55,3,599-605,https://doi.org/10.12740/PP/127886,ARTICLE
"https://www.psychiatriapolska.pl/Electromyographic-activity-analysis-of-temporal-and-masseter-muscles-in-psychoactive,110478,0,1.html",Elektromiograficzna analiza czynności mięśni żwaczy i skroniowych u osób uzależnionych od substancji psychoaktywnych,2021,55,3,607-620,https://doi.org/10.12740/PP/OnlineFirst/110478,ARTICLE
"https://www.psychiatriapolska.pl/Creutzfeldt-Jakob-disease-mimicking-Lewy-body-dementia-a-case-report,110915,0,1.html",Choroba Creutzfeldta-Jakoba o początkowym przebiegu naśladującym otępienie z ciałami Lewy’ego – opis przypadku,2021,55,3,621-627,https://doi.org/10.12740/PP/OnlineFirst/110915,ARTICLE
"https://www.psychiatriapolska.pl/The-scientific-path-of-Jakub-Frostig-in-the-light-of-his-correspondence-with-the,115487,0,1.html",Droga naukowa Jakuba Frostiga w świetle jego korespondencji z czołowymi przedstawicielami psychiatrii światowej – od psychoanalizy i podejścia fenomenologicznego do psychiatrii biologicznej. Część 1. Ku psychoanalizie i podejściu fenomenologicznemu,2021,55,3,629-641,https://doi.org/10.12740/PP/115487,ARTICLE
"https://www.psychiatriapolska.pl/The-scientific-path-of-Jakub-Frostig-in-the-light-of-his-correspondence-with-the,119862,0,1.html",Droga naukowa Jakuba Frostiga w świetle jego korespondencji z czołowymi przedstawicielami psychiatrii światowej – od psychoanalizy i podejścia fenomenologicznego do psychiatrii biologicznej. Część 2. W stronę psychiatrii biologicznej,2021,55,3,643-657,https://doi.org/10.12740/PP/119862,ARTICLE
"https://www.psychiatriapolska.pl/The-role-of-factors-associated-with-the-course-of-pregnancy-and-childbirth-in-attention,110686,0,1.html",Rola czynników związanych z przebiegiem ciąży i porodu w zespole nadpobudliwości psychoruchowej z deficytem uwagi,2021,55,3,659-673,https://doi.org/10.12740/PP/OnlineFirst/110686,ARTICLE
"https://www.psychiatriapolska.pl/Parental-stress-and-indifference-and-the-parent-s-withdrawal-from-the-relationship,115967,0,1.html","Stres rodzicielski, obojętność i wycofywanie się rodzica z relacji z dzieckiem: ujęcie strukturalne",2021,55,3,675-699,https://doi.org/10.12740/PP/115967,ARTICLE
"https://www.psychiatriapolska.pl/Recommendations-of-the-Polish-Sexological-Society-on-medical-care-in-transgender,125785,0,1.html",Zalecenia Polskiego Towarzystwa Seksuologicznego dotyczące opieki nad zdrowiem dorosłych osób transpłciowych – stanowisko panelu ekspertów,2021,55,3,701-708,https://doi.org/10.12740/PP/OnlineFirst/125785,ARTICLE
"https://www.psychiatriapolska.pl/Editorial,136168,0,1.html",Od Redakcji,2021,55,2,231-232,https://doi.org/10.12740/PP/136168,EDITORIAL
"https://www.psychiatriapolska.pl/Pharmacological-treatment-of-a-depressive-episode-and-recurrent-depressive-disorder,132496,0,1.html",Leczenie farmakologiczne epizodu depresji i zaburzeń depresyjnych nawracających – wytyczne Polskiego Towarzystwa Psychiatrycznego i Konsultanta Krajowego ds. Psychiatrii Dorosłych,2021,55,2,235-259,https://doi.org/10.12740/PP/OnlineFirst/132496,ARTICLE
"https://www.psychiatriapolska.pl/Etiopathogenesis-of-schizophrenia-the-state-of-the-art-for-2021,132953,0,1.html",Etiopatogeneza schizofrenii – stan wiedzy na rok 2021,2021,55,2,261-274,https://doi.org/10.12740/PP/132953,ARTICLE
"https://www.psychiatriapolska.pl/Long-term-psychoeducation-in-limiting-body-mass-gain-in-patients-treated-with-atypical,112004,0,1.html",Znaczenie długotrwałej psychoedukacji w ograniczeniu przyrostu masy ciała chorych przyjmujących atypowe leki przeciwpsychotyczne,2021,55,2,275-286,https://doi.org/10.12740/PP/OnlineFirst/112004,ARTICLE
"https://www.psychiatriapolska.pl/The-relationships-of-need-for-closure-dimensions-with-psychotic-like-experiences,131533,0,1.html",Związki między wymiarami potrzeby domknięcia poznawczego a doświadczeniami podobnymi do objawów psychotycznych oraz przeskokiem do konkluzji Badanie na dużej próbie populacyjnej,2021,55,2,287-307,https://doi.org/10.12740/PP/131533,ARTICLE
"https://www.psychiatriapolska.pl/Cognitive-functions-and-thyroid-hormones-secretion-disorders,112470,0,1.html",Wpływ zaburzeń sekrecji hormonów tarczycy na funkcje poznawcze,2021,55,2,309-321,https://doi.org/10.12740/PP/112470,ARTICLE
"https://www.psychiatriapolska.pl/Early-onset-Alzheimer-s-disease-a-case-study,114122,0,1.html",Choroba Alzheimera o wczesnym początku – opis przypadku,2021,55,2,323-330,https://doi.org/10.12740/PP/OnlineFirst/114122,ARTICLE
"https://www.psychiatriapolska.pl/Mediating-effect-of-coping-strategies-on-the-relation-between-social-support-and,118055,0,1.html",Mediacyjny wpływ strategii radzenia sobie ze stresem na relację między wsparciem społecznym a symptomami depresji u pacjentów po przeszczepieniu serca,2021,55,2,331-344,https://doi.org/10.12740/PP/118055,ARTICLE
"https://www.psychiatriapolska.pl/The-relationship-between-panic-disorder-and-hypertension-A-review-of-literature,116570,0,1.html",Związek pomiędzy zaburzeniem lękowym z napadami lęku a nadciśnieniem tętniczym. Przegląd piśmiennictwa,2021,55,2,345-361,https://doi.org/10.12740/PP/116570,ARTICLE
"https://www.psychiatriapolska.pl/Cardiac-syndrome-X-the-present-knowledge,113196,0,1.html",Kardiologiczny zespół X – aktualny stan wiedzy,2021,55,2,363-375,https://doi.org/10.12740/PP/OnlineFirst/113196,ARTICLE
"https://www.psychiatriapolska.pl/Mental-health-of-patients-suffering-from-connective-tissue-diseases-Negative-and,116673,0,1.html",Zdrowie psychiczne osób z chorobami tkanki łącznej. Ujęcie negatywne i pozytywne oraz wybrane korelaty,2021,55,2,377-396,https://doi.org/10.12740/PP/116673,ARTICLE
"https://www.psychiatriapolska.pl/Coexistence-of-DiGeorge-syndrome-with-Fahr-syndrome-mosaic-Turner-syndrome-and-psychiatric,119376,0,1.html","Zaburzenia psychiatryczne u pacjentki z zespołem DiGeorge’a, zespołem Fahra i zespołem Turnera – opis przypadku",2021,55,2,397-404,https://doi.org/10.12740/PP/119376,ARTICLE
"https://www.psychiatriapolska.pl/Orthorexia-current-approach-A-review,115149,0,1.html",Ortoreksja – aktualne ujęcie problemu. Przegląd badań,2021,55,2,405-420,https://doi.org/10.12740/PP/115149,REVIEW
"https://www.psychiatriapolska.pl/Orthorexia-nervosa-a-distorted-approach-to-healthy-eating,125387,0,1.html",Ortoreksja – wypaczone podejście do zdrowego odżywiania się,2021,55,2,421-433,https://doi.org/10.12740/PP/125387,ARTICLE
"https://www.psychiatriapolska.pl/False-positive-drug-test-results-in-patients-taking-psychotropic-drugs-A-literature,113173,0,1.html",Fałszywie dodatnie wyniki testów narkotykowych u pacjentów przyjmujących leki psychotropowe – przegląd literatury,2021,55,2,435-446,https://doi.org/10.12740/PP/113173,REVIEW
"https://www.psychiatriapolska.pl/Negative-consequences-of-novel-psychoactive-substances-use-among-the-Polish-users,116140,0,1.html",Negatywne konsekwencje wynikające z przyjmowania nowych substancji psychoaktywnych przez polskich użytkowników,2021,55,2,447-469,https://doi.org/10.12740/PP/116140,ARTICLE
"https://www.psychiatriapolska.pl/Editorial,134129,0,1.html",Od Redakcji,2021,55,1,3-4,https://doi.org/10.12740/PP/134129,EDITORIAL
"https://www.psychiatriapolska.pl/Treatment-resistant-depression-recommendations-of-the-National-Consultant-in-the,115208,0,1.html",Depresja oporna na leczenie – zalecenia Konsultanta Krajowego w dziedzinie psychiatrii,2021,55,1,7-21,https://doi.org/10.12740/PP/OnlineFirst/115208,ARTICLE
"https://www.psychiatriapolska.pl/Gender-dysphoria-gender-incongruence-and-gender-nonconformity-in-adolescence-changes,113009,0,1.html","Dysforia płciowa, niezgodność płciowa i nonkonformizm płciowy w adolescencji – zmiany i wyzwania diagnostyczne",2021,55,1,23-37,https://doi.org/10.12740/PP/OnlineFirst/113009,ARTICLE
