url,title,year,volume,issue,pages,doi,article_type
"https://www.psychiatriapolska.pl/The-assessment-of-metabolism-of-bone-tissue-as-changes-in-concentration-of-biochemical,154527,0,1.html",Ocena  metabolizmu tkanki kostnej u kobiet uzależnionych od alkoholu z  zastosowaniem markerów obrotu kostnego – osteokalcyny i ctx,2013,47,1,17-30,,ARTICLE
"https://www.psychiatriapolska.pl/The-level-of-anxiety-and-depression-in-the-early-puerperium-preliminary-communication,154528,0,1.html",Poziom lęku  jako stanu i jako cechy oraz depresji we wczesnym połogu – doniesienie  wstępne,2013,47,1,31-40,,ARTICLE
"https://www.psychiatriapolska.pl/Real-self-and-ideal-self-of-pregnant-and-postpartum-women-with-symptoms-of-perinatal,154529,0,1.html",Ja  realne i ja idealne u kobiet ciężarnych i położnic z objawami depresji  okołoporodowej,2013,47,1,41-52,,ARTICLE
"https://www.psychiatriapolska.pl/Psychological-gender-in-clinical-depression-Preliminary-study,154530,0,1.html",Płeć  psychologiczna osób z depresją kliniczną. Doniesienia wstępne.,2013,47,1,53-64,,ARTICLE
"https://www.psychiatriapolska.pl/Difficult-road-to-diagnosing-dementia-with-Lewy-bodies-DLB-Case-report-,154531,0,1.html",Trudna droga do rozpoznania otępienia z ciałami Lewy’ego. Opis przypadku,2013,47,1,65-74,,ARTICLE
"https://www.psychiatriapolska.pl/TMS-in-therapy-of-depressions-the-problem-of-determining-the-area-to-be-stimulated,154532,0,1.html",Obrazowanie  diagnostyczne kłamstwa,2013,47,1,75-87,,ARTICLE
"https://www.psychiatriapolska.pl/Correlations-between-Attention-Deficit-Hyperactivity-Disorder-and-Obesity-a-systematic,154533,0,1.html","Stymulacja  TMS w terapii depresji – problem miejsca stymulacji, czyli kilka słów o  anatomii zaburzeń depresyjnych",2013,47,1,89-102,,REVIEW
"https://www.psychiatriapolska.pl/Neurochemistry-of-impulsiveness-and-aggression,154534,0,1.html",Związki  między zespołem nadpobudliwości psychoruchowej (ADHD) a otyłością –  systematyczny przegląd literatury,2013,47,1,103-115,,ARTICLE
"https://www.psychiatriapolska.pl/Pharmacological-features-of-naltrexone-and-its-use-in-the-treatment-of-alcohol-dependence,154535,0,1.html",Neurochemia  impulsywności i agresji,2013,47,1,117-126,,ARTICLE
"https://www.psychiatriapolska.pl/Addiction-to-phenelzine-case-report,154536,0,1.html",Zastosowanie  naltreksonu w terapii uzależnienia od alkoholu – aspekty  farmakologiczne,2013,47,1,127-134,,ARTICLE
"https://www.psychiatriapolska.pl/Suicides-among-patients-with-mental-disorders-case-studies,154537,0,1.html",„Uzależnienie”  od fenelzyny – opis przypadku,2013,47,1,135-146,,ARTICLE
"https://www.psychiatriapolska.pl/Difficult-road-to-diagnosing-dementia-with-Lewy-bodies-DLB-Case-report,154538,0,1.html",Samobójstwa  wśród chorych z zaburzeniami psychicznymi – opisy przypadków,2013,47,1,147-158,,ARTICLE
"https://www.psychiatriapolska.pl/Dysfunctional-meta-cognitive-beliefs-and-anxiety-depression-and-self-esteem-among,154509,0,1.html","Dysfunkcjonalne przekonania metapoznawcze oraz lęk, depresja i samoocena u osób zdrowych psychicznie mających doświadczenia podobne do omamów",2012,46,6,933-949,,ARTICLE
"https://www.psychiatriapolska.pl/The-comparison-of-self-image-before-and-after-the-psychotic-crisis-the-analysis-of,154510,0,1.html",Porównanie obrazu siebie przed i po wystąpieniu kryzysu psychotycznego poprzez analizę narracji osób chorych na schizofrenię,2012,46,6,951-960,,ARTICLE
"https://www.psychiatriapolska.pl/Do-deficits-of-working-memory-and-executive-functions-more-severe-in-adolescent-schizophrenic,154511,0,1.html",Czy zaburzenia pamięci operacyjnej i funkcji wykonawczych u adolescentów chorych na schizofrenię są bardziej nasilone niż u dorosłych chorych na schizofrenię?,2012,46,6,961-973,,ARTICLE
"https://www.psychiatriapolska.pl/The-association-of-quality-of-life-with-mental-status-and-sociodemographic-data-in,154512,0,1.html",Ocena wpływu wybranych czynników psychicznych i socjodemograficznych na jakość życia pacjentów ze schizofrenią,2012,46,6,975-984,,ARTICLE
"https://www.psychiatriapolska.pl/Physicians-opinion-on-the-use-of-perazine-in-the-treatment-of-mental-disorders-results,154513,0,1.html",Opinie lekarzy dotyczące perazyny w leczeniu zaburzeń psychicznych – wyniki badania metodą delficką,2012,46,6,985-993,,ARTICLE
"https://www.psychiatriapolska.pl/A-new-role-of-people-suffering-from-mental-illnesses-in-treatment-and-recovery,154514,0,1.html",Nowe role osób chorujących psychicznie w procesie leczenia i zdrowienia,2012,46,6,995-1005,,ARTICLE
"https://www.psychiatriapolska.pl/Sense-of-humour-in-patients-with-depression-review,154515,0,1.html",Poczucie humoru u pacjentów z depresją – przegląd badań,2012,46,6,1007-1018,,ARTICLE
"https://www.psychiatriapolska.pl/Comorbidity-and-characteristic-of-obsessive-compulsive-symptoms-in-anorexia-nervosa,154516,0,1.html",Współwystępowanie i charakter objawów obsesyjno-kompulsyjnych w jadłowstręcie psychicznym,2012,46,6,1019-1028,,ARTICLE
"https://www.psychiatriapolska.pl/Psychiatric-manifestations-of-autoimmune-diseases-diagnostic-and-therapeutic-problems,154518,0,1.html",Zaburzenia psychiczne w chorobach autoimmunologicznych – problemy diagnostyczno-terapeutyczne,2012,46,6,1029-1042,,ARTICLE
"https://www.psychiatriapolska.pl/The-role-of-oxytocin-and-vasopressin-in-central-nervous-system-activity-and-mental,154520,0,1.html",Rola oksytocyny i wazopresyny w czynności ośrodkowego układu nerwowego i w zaburzeniach psychicznych,2012,46,6,1043-1052,,ARTICLE
"https://www.psychiatriapolska.pl/Seeking-the-aetiology-of-autistic-spectrum-disorder-Part-1-structural-neuroimaging,154521,0,1.html",W poszukiwaniu przyczyn zaburzeń ze spektrum autyzmu – neuroobrazowanie strukturalne (część I),2012,46,6,1053-1060,,ARTICLE
"https://www.psychiatriapolska.pl/Seeking-the-aetiology-of-autistic-spectrum-disorder-Part-2-functional-neuroimaging,154522,0,1.html",W poszukiwaniu przyczyn zaburzeń ze spektrum autyzmu – neuroobrazowanie funkcjonalne (część II),2012,46,6,1061-1071,,ARTICLE
"https://www.psychiatriapolska.pl/Faces-affect-recognition-in-schizophrenia,154523,0,1.html",Rozpoznawanie emocjonalnej ekspresji mimicznej przez osoby chore na schizofrenię,2012,46,6,1073-1088,,ARTICLE
"https://www.psychiatriapolska.pl/The-use-of-RHLB-battery-for-the-evaluation-of-the-lingual-and-social-skills-among,154524,0,1.html",Zastosowanie baterii RHLB do oceny funkcji językowych i komunikacyjnych pacjentów psychiatrycznych – opis przypadku,2012,46,6,1089-1098,,ARTICLE
"https://www.psychiatriapolska.pl/Psychotic-symptoms-and-cognitive-impairment-in-neurosarcoidosis-Case-report-and-review,154525,0,1.html",Objawy psychotyczne i zaburzenia poznawcze w przebiegu neurosarkoidozy – opis przypadku i przegląd piśmiennictwa,2012,46,6,1099-1108,,REVIEW
"https://www.psychiatriapolska.pl/An-influence-of-mental-stress-related-to-parachute-jumping-on-ACTH-and-cortizol-hormones,154493,0,1.html",Wpływ stresu związanego ze skokami spadochronowymi na stężenie ACTH i kortyzolu w surowicy krwi,2012,46,5,731-742,,ARTICLE
"https://www.psychiatriapolska.pl/The-formation-of-a-temporal-perspective-as-an-aspect-of-adaptation-to-disease-and,154494,0,1.html",Kształtowanie perspektywy temporalnej jako aspekt adaptacji do choroby i leczenia. Analiza oparta na badaniach chorych leczonych nerkozastępczo,2012,46,5,743-756,,ARTICLE
"https://www.psychiatriapolska.pl/The-cognitive-functioning-of-patients-with-heart-disease-treated-cardiosurgically,154495,0,1.html",Funkcjonowanie poznawcze osób z chorobą niedokrwienną serca leczonych kardiochirurgicznie – ocena przed i po zabiegu. Badania pilotażowe,2012,46,5,757-769,,ARTICLE
"https://www.psychiatriapolska.pl/Long-term-mood-assessment-in-bipolar-affective-disorder,154496,0,1.html",Długoterminowa ocena nastroju w chorobie afektywnej dwubiegunowej,2012,46,5,771-780,,ARTICLE
"https://www.psychiatriapolska.pl/Polish-version-of-the-ADOS-Autism-Diagnostic-Observation-Schedule-Generic-,154497,0,1.html",Polska wersja narzędzia obserwacyjnego do diagnozowania autyzmu ADOS,2012,46,5,781-789,,ARTICLE
"https://www.psychiatriapolska.pl/Medical-students-sexuality-beliefs-and-attitudes,154498,0,1.html",Seksualność studentów medycyny – przekonania i postawy,2012,46,5,791-805,,ARTICLE
"https://www.psychiatriapolska.pl/Image-of-female-to-male-transsexuals-in-Polish-society,154499,0,1.html",Obraz transseksualistów typu kobieta-mężczyzna w społeczeństwie polskim,2012,46,5,807-814,,ARTICLE
"https://www.psychiatriapolska.pl/Stage-models-of-homosexual-identity-formation-Implications-for-therapeutic-practice,154500,0,1.html",Stadialne modele formowania się tożsamości homoseksualnej. Implikacje dla praktyki terapeutycznej,2012,46,5,815-828,,ARTICLE
"https://www.psychiatriapolska.pl/Personality-disroders-different-outlooks-and-attempts-at-their-integration,154501,0,1.html",Zaburzenia osobowości – różne spojrzenia i próby ich integracji,2012,46,5,829-844,,ARTICLE
"https://www.psychiatriapolska.pl/Exercise-dependence-symptoms-and-mechanisms,154502,0,1.html",Uzależnienie od ćwiczeń fizycznych – objawy i mechanizmy,2012,46,5,845-856,,ARTICLE
"https://www.psychiatriapolska.pl/The-concept-of-the-dialogical-self-in-psychotherapy-theoretical-assumptions,154503,0,1.html",Koncepcja dialogowego Ja w psychoterapii – założenia teoretyczne,2012,46,5,857-865,,ARTICLE
"https://www.psychiatriapolska.pl/The-concept-of-dialogical-self-and-its-application-for-psychotherapy-and-especially,154504,0,1.html","Zastosowania koncepcji dialogowego Ja w psychoterapii, zwłaszcza w terapii rodzin",2012,46,5,867-875,,ARTICLE
"https://www.psychiatriapolska.pl/Close-cooperation-between-the-physician-and-the-psychotherapist-in-the-Personality,154505,0,1.html",Współpraca lekarza z psychoterapeutą na Oddziale Leczenia Zaburzeń Osobowości i Nerwic,2012,46,5,877-889,,ARTICLE
"https://www.psychiatriapolska.pl/Depression-in-patients-with-epilepsy,154506,0,1.html",Depresja u chorych z padaczką,2012,46,5,891-902,,ARTICLE
"https://www.psychiatriapolska.pl/Depression-or-apathy-A-diagnostic-trap-a-huge-right-frontal-lobe-meningioma-diagnosed,154507,0,1.html",Depresja czy apatia? Pułapki diagnostyczne: olbrzymi oponiak prawego płata czołowego rozpoznany i leczony jako epizod depresji umiarkowanej atypowej – opis przypadku,2012,46,5,903-913,,ARTICLE
"https://www.psychiatriapolska.pl/Is-Huntington-s-disease-a-neurological-or-psychiatric-disorder-Case-report,154508,0,1.html",Choroba Huntingtona zaburzeniem neurologicznym czy psychiatrycznym? Opis przypadku,2012,46,5,915-922,,ARTICLE
"https://www.psychiatriapolska.pl/Retrospective-analysis-of-the-course-of-psychotic-episodes-in-adolescent-inpatients,154477,0,1.html",Retrospektywna  analiza przebiegu epizodów psychotycznych u hospitalizowanej młodzieży,2012,46,4,511-521,,ARTICLE
"https://www.psychiatriapolska.pl/Differences-in-marital-communication-and-parental-attitudes-between-parents-of-healthy,154478,0,1.html",Różnice  w komunikacji małżeńskiej i postawach rodzicielskich między rodzicami  dzieci zdrowych a rodzicami dzieci chorych na cukrzycę typu 1,2012,46,4,523-538,,ARTICLE
"https://www.psychiatriapolska.pl/The-neutral-and-affective-verbal-fluency-in-people-with-right-left-or-both-hemisphere,154479,0,1.html","Fluencja  słowna neutralna i afektywna u chorych z uszkodzeniem prawej, lewej lub  obu półkul mózgu",2012,46,4,539-551,,ARTICLE
"https://www.psychiatriapolska.pl/Language-disorders-and-cognitive-functions-in-persons-with-schizophrenic-disorders,154480,0,1.html",Zaburzenia  językowe a inne wybrane funkcje poznawcze u osób chorujących na  zaburzenia schizofreniczne,2012,46,4,553-570,,ARTICLE
"https://www.psychiatriapolska.pl/Risk-factors-of-schizophrenia-development-in-patients-with-amphetamines-dependence,154481,0,1.html",Czynniki  ryzyka rozwoju schizofrenii u pacjentów uzależnionych od amfetaminy i  jej pochodnych z psychozą  (pointoksykacyjną lub schizofrenią) oraz bez  psychozy,2012,46,4,571-584,,ARTICLE
"https://www.psychiatriapolska.pl/Augmentation-of-antidepressants-with-unsaturated-fatty-acids-omega-3-in-drug-resistant,154482,0,1.html",Potencjalizacja  leków przeciwdepresyjnych kwasami tłuszczowymi omega-3 w depresji  lekoopornej,2012,46,4,585-598,,ARTICLE
"https://www.psychiatriapolska.pl/Activity-of-selected-cytokines-in-bipolar-patients-during-manic-and-depressive-episodes,154483,0,1.html",Ocena  aktywności wybranych cytokin w epizodzie maniakalnym i depresyjnym  choroby afektywnej dwubiegunowej,2012,46,4,599-611,,ARTICLE
"https://www.psychiatriapolska.pl/Staging-of-bipolar-affective-illness,154484,0,1.html",Etapy  przebiegu choroby afektywnej dwubiegunowej,2012,46,4,613-626,,ARTICLE
"https://www.psychiatriapolska.pl/The-effect-of-long-term-lithium-treatment-on-kidney-function,154485,0,1.html",Wpływ  długotrwałego podawania litu na czynność nerek,2012,46,4,627-636,,ARTICLE
"https://www.psychiatriapolska.pl/Mental-health-of-homosexual-and-bisexual-people-review-of-research-and-presentation,154486,0,1.html",Zdrowie  psychiczne osób homoseksualnych i biseksualnych – przegląd badań i  prezentacja zjawiska,2012,46,4,637-647,,ARTICLE
"https://www.psychiatriapolska.pl/Mental-health-of-homosexual-and-bisexual-people-role-of-minority-stress,154487,0,1.html",Zdrowie  psychiczne osób homoseksualnych i biseksualnych – rola stresu  mniejszościowego,2012,46,4,649-663,,ARTICLE
"https://www.psychiatriapolska.pl/Schizophrenia-like-psychotic-symptoms-in-a-patient-with-confirmed-Huntington-s-disease,154488,0,1.html",Objawy  psychotyczne sugerujące schizofrenię u pacjenta z potwierdzonym  rozpoznaniem choroby Huntingtona – opis przypadku,2012,46,4,665-675,,ARTICLE
"https://www.psychiatriapolska.pl/Munchausen-syndrome-by-proxy-in-a-forensic-psychiatric-evaluation-the-description,154489,0,1.html",Przeniesiony zespół Münchausena w opinii sądowo-psychiatrycznej – opis  przypadku i kontrowersje etyczne,2012,46,4,677-689,,ARTICLE
"https://www.psychiatriapolska.pl/Contemporary-research-directions-in-Polish-psychiatry-Psychiatria-Polska-on-the-basis,154490,0,1.html",Współczesne  kierunki badawcze w polskiej psychiatrii na podstawie publikacji w  Psychiatrii Polskiej w latach  2010–2012. Doniesienie wstępne,2012,46,4,691-707,,ARTICLE
"https://www.psychiatriapolska.pl/REMEMBERING-POSTHUMOUS-Professor-Stanislaw-Dabrowski-1922-2012-He-was-a-co-initiator,154491,0,1.html",Wspomnienie  pośmiertne Profesor Stanisław Dąbrowski 1922–2012,2012,46,4,715-721,,
"https://www.psychiatriapolska.pl/Psychiatry-Poland,154492,0,1.html",Omówienia  książek i czasopism,,,,,,EDITORIAL
"https://www.psychiatriapolska.pl/Clinical-analysis-of-safety-and-effectiveness-of-electroconvulsive-therapy,154463,0,1.html",Analiza  kliniczna skuteczności i bezpieczeństwa leczenia elektrowstrząsowego,2012,46,3,345-360,,ARTICLE
"https://www.psychiatriapolska.pl/Impact-of-treatment-with-acetylcholinesterase-inhibitors-valproic-acid-and-antipsychotics,154464,0,1.html","Wpływ  farmakoterapii inhibitorami acetylocholinesterazy, kwasem walproinowym i  lekami przeciwpsychotycznymi na zachowania agresywne w przebiegu  otępienia typu Alzheimera",2012,46,3,361-372,,ARTICLE
"https://www.psychiatriapolska.pl/Total-abstinence-or-harm-reduction-different-strategies-of-alcohol-treatment-in-research,154465,0,1.html",Całkowita  abstynencja czy redukcja szkód – różne strategie terapii uzależnienia  od alkoholu w świetle badań i międzynarodowych zaleceń,2012,46,3,373-386,,ARTICLE
"https://www.psychiatriapolska.pl/Personality-in-the-Big-Five-Model-and-maintaining-abstinence-after-one-year-follow,154466,0,1.html",Osobowość w Modelu Wielkiej Piątki a utrzymywanie abstynencji od  alkoholu przez rok od rozpoczęcia leczenia,2012,46,3,387-399,,ARTICLE
"https://www.psychiatriapolska.pl/Emotion-regulation-in-borderline-personality-disorder-actual-research-directions,154467,0,1.html",Regulacja  emocji u pacjentów z zaburzeniem osobowości borderline – aktualne  kierunki badań,2012,46,3,401-408,,ARTICLE
"https://www.psychiatriapolska.pl/Relationship-between-emotion-regulation-and-emotional-intelligence-in-borderline,154468,0,1.html",Strategie  regulacji emocji a inteligencja emocjonalna u pacjentów z zaburzeniem  osobowości borderline,2012,46,3,409-420,,ARTICLE
"https://www.psychiatriapolska.pl/Ethical-problems-in-the-treatment-of-schizophrenia,154469,0,1.html",Problemy  etyczne w terapii schizofrenii,2012,46,3,421-428,,ARTICLE
"https://www.psychiatriapolska.pl/Anorexia-nervosa-in-light-of-Karl-Jaspers-and-Erich-Fromm-s-ideas-and-social-constructivism,154470,0,1.html","Anoreksja  psychiczna z perspektywy koncepcji Karla Jaspersa, Ericha Fromma oraz  nurtu konstrukcjonizmu społecznego – hipotezy i refleksje",2012,46,3,429-440,,ARTICLE
"https://www.psychiatriapolska.pl/Orthorexia-a-new-diagnosis-,154471,0,1.html",Ortoreksja  – nowe rozpoznanie?,2012,46,3,441-450,,ARTICLE
"https://www.psychiatriapolska.pl/Mental-health-problems-in-ethnic-minority-groups,154472,0,1.html",Problemy  psychiczne w grupach mniejszości etnicznych i narodowych,2012,46,3,451-459,,ARTICLE
"https://www.psychiatriapolska.pl/Iowa-Gambling-Task-tool-for-assessment-of-decision-making,154473,0,1.html",Iowa  Gambling Task – narzędzie do oceny podejmowania decyzji,2012,46,3,461-472,,ARTICLE
"https://www.psychiatriapolska.pl/Cognitive-dysfunction-after-cardiac-surgery,154474,0,1.html",Zaburzenia  funkcjonowania poznawczego po zabiegach kardiochirurgicznych,2012,46,3,473-482,,ARTICLE
"https://www.psychiatriapolska.pl/Before-you-diagnose-a-patient-with-a-conversion-disorder-perform-a-thorough-general,154475,0,1.html","Zanim  rozpoznasz u pacjenta zaburzenie konwersyjne, dokładnie zbadaj jego  stan somatyczny i neurologiczny. Opis przypadku",2012,46,3,483-492,,ARTICLE
"https://www.psychiatriapolska.pl/National-Programme-for-Mental-Health-an-idea-or-reality-,154476,0,1.html",Narodowy  Program Ochrony Zdrowia Psychicznego– idea czy rzeczywistość?,2012,46,3,499-502,,EDITORIAL
"https://www.psychiatriapolska.pl/The-present-level-of-post-traumatic-stress-symptoms-in-a-sample-of-child-survivors,154447,0,1.html","Aktualny  poziom objawów stresu potraumatycznego w próbie osób, które w  dzieciństwie przeżyły II wojnę światową",2012,46,2,145-156,,ARTICLE
"https://www.psychiatriapolska.pl/Intensification-of-interpersonal-sense-of-guilt-in-patients-with-schizophrenia,154448,0,1.html",Nasilenie  interpersonalnego poczucia winy w schizofrenii paranoidalnej,2012,46,2,157-166,,ARTICLE
"https://www.psychiatriapolska.pl/Prevalence-of-selected-personal-resources-in-persons-with-schizophrenia-diagnosis,154449,0,1.html",Występowanie wybranych zasobów osobistych u osób z rozpoznaniem  schizofrenii,2012,46,2,167-176,,ARTICLE
"https://www.psychiatriapolska.pl/Retrospective-analysis-of-psychopathological-presentation-of-psychotic-episodes-in,154450,0,1.html",Retrospektywna  analiza obrazu psychopatologicznego epizodów psychotycznych u  hospitalizowanej młodzieży,2012,46,2,177-188,,ARTICLE
"https://www.psychiatriapolska.pl/The-cultural-context-of-eating-disorders-own-research,154451,0,1.html",Kontekst  kulturowy zaburzeń odżywiania się – badania własne,2012,46,2,189-200,,ARTICLE
"https://www.psychiatriapolska.pl/Predictors-of-symptomatic-improvement-in-eating-disorders-Preliminary-analysis,154452,0,1.html",Predyktory  poprawy objawowej w zaburzeniach odżywiania się. Analiza wstępna,2012,46,2,201-212,,ARTICLE
"https://www.psychiatriapolska.pl/Worrying-behaviours-of-children-in-the-assessment-of-kindergarten-teachers-in-Krakow,154453,0,1.html",Niepokojące  zachowania dzieci w ocenie krakowskich nauczycieli przedszkolnych,2012,46,2,213-225,,ARTICLE
"https://www.psychiatriapolska.pl/The-evaluation-of-the-stress-coping-styles-and-emotional-intelligence-in-psychiatrically,154454,0,1.html",Ocena stylów radzenia sobie ze stresem i inteligencji emocjonalnej u  samouszkadzającej się młodzieży leczonej psychiatrycznie w zależności od  wybranych czynników klinicznych,2012,46,2,227-240,,ARTICLE
"https://www.psychiatriapolska.pl/Diagnostic-difficulties-in-adolescent-patients-subjective-psychiatrist-side-factors,154455,0,1.html",Trudności diagnostyczne u pacjentów w okresie dojrzewania – czynniki  subiektywne po stronie lekarza,2012,46,2,241-247,,ARTICLE
"https://www.psychiatriapolska.pl/Polish-version-of-the-ADI-R-Autism-Diagnostic-Interview-Revised-,154456,0,1.html",Polska wersja wywiadu do diagnozowania autyzmu ADI-R (Autism Diagnostic  Interview – Revised),2012,46,2,249-259,,ARTICLE
"https://www.psychiatriapolska.pl/MATRICS-consensus-cognitive-battery-standard-for-the-assessment-of-cognitive-functions,154457,0,1.html",Bateria  testów MATRICS – standard oceny funkcji poznawczych w badaniach  klinicznych w schizofrenii,2012,46,2,261-271,,ARTICLE
"https://www.psychiatriapolska.pl/Results-of-the-Trail-Making-Test-among-patients-suffering-from-depressive-disorders,154458,0,1.html",Wykonanie  Testu Łączenia Punktów przez osoby z depresją i organicznymi  zaburzeniami depresyjnymi,2012,46,2,273-282,,ARTICLE
"https://www.psychiatriapolska.pl/Antidepressant-effect-of-ketamine-a-N-methyl-D-aspartate-NMDA-glutamate-receptor,154459,0,1.html",Zastosowanie  antagonisty receptorów NMDA (N-metylo-D-asparaginianu) – ketaminy w  leczeniu depresji lekoopornej,2012,46,2,283-294,,ARTICLE
"https://www.psychiatriapolska.pl/The-Euro-orphans-phenomenon-and-the-courses-in-therapeutic-work-and-psychiatric-treatment,154460,0,1.html",Zjawisko  eurosieroctwa a kierunki pracy terapeutycznej i leczenia  psychiatrycznego – prezentacja przypadku,2012,46,2,295-304,,ARTICLE
"https://www.psychiatriapolska.pl/Faith-vs-science-soul-s-possession-or-dissociative-disorder-A-case-study,154461,0,1.html",Pomiędzy  wiarą a nauką: zniewolenie duszy czy zaburzenia dysocjacyjne?  Prezentacja przypadku,2012,46,2,305-312,,ARTICLE
"https://www.psychiatriapolska.pl/The-new-position-of-Polish-Psychiatry-Library,154462,0,1.html",Zalecenia w sprawie stosowania leków przeciwpsychotycznych II generacji             969-977,,,,,,EDITORIAL
"https://www.psychiatriapolska.pl/The-new-position-of-Polish-Psychiatry-Library,154436,0,1.html",Recenzja,2012,46,1,3,,EDITORIAL
"https://www.psychiatriapolska.pl/Forensic-psychologist-s-considerations-about-the-new-law-regulation-in-cases-of-sexual,154437,0,1.html",Uwagi psychologa sądowego o nowych regulacjach prawnych w sprawach o tzw. przestępstwa seksualne,2012,46,1,5-19,,ARTICLE
"https://www.psychiatriapolska.pl/Sexual-health-symptoms-and-problems-in-a-population-of-patients-in-a-day-hospital,154438,0,1.html",Objawy i problemy związane z seksualnością pacjentów dziennego oddziału leczenia zaburzeń nerwicowych,2012,46,1,21-34,,ARTICLE
"https://www.psychiatriapolska.pl/Medical-students-sexuality-development-and-fulfilment-of-sexual-needs,154439,0,1.html",Seksualność studentów medycyny – rozwój i realizacja potrzeb seksualnych,2012,46,1,35-49,,ARTICLE
"https://www.psychiatriapolska.pl/Psychosexual-functioning-of-women-after-breast-cancer-therapy,154440,0,1.html",Funkcjonowanie psychoseksualne kobiet po leczeniu raka sutka,2012,46,1,51-61,,ARTICLE
"https://www.psychiatriapolska.pl/Evaluation-of-anxiety-and-depression-in-the-perioperative-period-in-patients-subjected,154441,0,1.html",Ocena lęku i depresji w okresie okołooperacyjnym u pacjentów poddawanych rewaskularyzacji mięśnia sercowego,2012,46,1,63-74,,ARTICLE
"https://www.psychiatriapolska.pl/Attachment-styles-childhood-and-adult-traumatic-experiences-mental-states-and-methods,154442,0,1.html","Style przywiązania, traumatyczne doświadczenia z okresu dzieciństwa i dorosłości, stany psychiczne oraz metody podejmowania prób samobójczych przez kobiety leczone psychiatrycznie",2012,46,1,75-84,,ARTICLE
"https://www.psychiatriapolska.pl/Influence-of-antidepressant-pharmacotherapy-on-the-course-of-cancer,154443,0,1.html",Wpływ farmakoterapii przeciwdepresyjnej na przebieg choroby nowotworowej,2012,46,1,85-94,,ARTICLE
"https://www.psychiatriapolska.pl/Polish-version-of-Comprehensive-Assessment-of-At-Risk-Mental-States-CAARMS-the-description,154444,0,1.html",Polska wersja Kompleksowej Oceny Zagrażających Stanów Psychicznych (CAARMS) – opis metody,2012,46,1,95-107,,ARTICLE
"https://www.psychiatriapolska.pl/Randomized-controlled-trials-in-psychiatry,154445,0,1.html",Badania z randomizacją w psychiatrii,2012,46,1,109-121,,ARTICLE
"https://www.psychiatriapolska.pl/Leon-Daraszkiewicz-and-his-monograph-on-hebephrenia,154446,0,1.html",Leon Daraszkiewicz i jego monografia o hebefrenii,2012,46,1,123-131,,ARTICLE
"https://www.psychiatriapolska.pl/Toward-the-new-classification-of-mental-disorders-Polish-psychiatrists-opinions-about,154422,0,1.html",W kierunku nowej klasyfikacji zaburzeń psychicznych – opinie polskich psychiatrów dotyczące projektu ICD-11,2011,45,6,785-798,,ARTICLE
"https://www.psychiatriapolska.pl/Patients-and-families-satisfaction-from-services-provided-in-community-care-pilot,154423,0,1.html",Satysfakcja pacjentów i rodzin z opieki środowiskowej – badanie pilotażowe,2011,45,6,799-809,,ARTICLE
"https://www.psychiatriapolska.pl/Associations-between-candidate-genes-with-schizophrenia-susceptibility-and-the-treatment,154424,0,1.html",Analiza genów kandydujących związanych z predyspozycją do schizofrenii i z efektem leczenia przeciwpsychotycznego,2011,45,6,811-823,,ARTICLE
"https://www.psychiatriapolska.pl/Changes-in-positive-and-negative-symptoms-general-psychopathology-in-schizophrenic,154425,0,1.html","Zmiana w zakresie objawów pozytywnych, negatywnych oraz psychopatologii ogólnej u pacjentów ze schizofrenią otrzymujących augmentację leczenia przeciwpsychotycznego glicyną: wyniki wstępnego 10-tygodniowego badania otwartego",2011,45,6,825-837,,ARTICLE
