journal_id,journal_label,pep_code_candidate,probe_year,document_id,pep_code_record,year_record,title,authors,source_title,volume,issue,pages,doi,article_type,has_abstract,has_keywords,n_keywords,keywords_joined,keyword_source,art_kwds_count,source_file
psychoanalytic_psychology,Psychoanalytic Psychology,PPSY,2007,PPSY.024.0355A,PPSY,2007,Splits in the Self Following Immigration: An Adaptive Defense or a Pathological Reaction?,Sophie D. Walsh and  Shmuel Shulman,Psychoanalytic Psychology,24,2,355-372,,ART,True,True,4,immigration; damage to self; splitting in a sense of self; mourning processes,documentInfoXML/artkwds,1,data\raw_pep_metadata\psychoanalytic_psychology\2007\psychoanalytic_psychology_PPSY_2007_art_id_PPSY._AND_year_2007.json
psychoanalytic_psychology,Psychoanalytic Psychology,PPSY,2007,PPSY.024.0333A,PPSY,2007,"Mind, Brain, and Self in Psychoanalysis: Therapeutic Implications of the Mind-Body Relation",W. W. Meissner,Psychoanalytic Psychology,24,2,333-354,,ART,True,True,5,mind-brain relation; dual-track approach; self; medication; therapeutic alliance,documentInfoXML/artkwds,1,data\raw_pep_metadata\psychoanalytic_psychology\2007\psychoanalytic_psychology_PPSY_2007_art_id_PPSY._AND_year_2007.json
psychoanalytic_psychology,Psychoanalytic Psychology,PPSY,2007,PPSY.024.0010A,PPSY,2007,Psychoanalysis and its Critics,Morris N. Eagle,Psychoanalytic Psychology,24,1,10-24,,ART,True,False,0,,,0,data\raw_pep_metadata\psychoanalytic_psychology\2007\psychoanalytic_psychology_PPSY_2007_art_id_PPSY._AND_year_2007.json
psychoanalytic_psychology,Psychoanalytic Psychology,PPSY,2007,PPSY.024.0397A,PPSY,2007,Response to Jon Mills: An Open Letter to the Members of Division 39,Jody Messler Davies,Psychoanalytic Psychology,24,2,397-400,,COM,True,True,3,subject relations; relational psychoanalysis; Mills' response,documentInfoXML/artkwds,1,data\raw_pep_metadata\psychoanalytic_psychology\2007\psychoanalytic_psychology_PPSY_2007_art_id_PPSY._AND_year_2007.json
psychoanalytic_psychology,Psychoanalytic Psychology,PPSY,2007,PPSY.024.0180A,PPSY,2007,One Mind or Two: Divergent Views of the Home-Office Setting Commentary on Maroda (2006),Robert Langs,Psychoanalytic Psychology,24,1,180-186,,COM,True,False,0,,,0,data\raw_pep_metadata\psychoanalytic_psychology\2007\psychoanalytic_psychology_PPSY_2007_art_id_PPSY._AND_year_2007.json
psychoanalytic_psychology,Psychoanalytic Psychology,PPSY,2007,PPSY.024.0231A,PPSY,2007,Therapeutic Alliance: Theme and Variations,W. W. Meissner,Psychoanalytic Psychology,24,2,231-254,,ART,True,True,5,analytic relation; countertransference; real relation; therapeutic alliance; transference,documentInfoXML/artkwds,1,data\raw_pep_metadata\psychoanalytic_psychology\2007\psychoanalytic_psychology_PPSY_2007_art_id_PPSY._AND_year_2007.json
